1592721	Agility is a multifaceted concept in various sports disciplines.	14	ok
4865646	Apple's CEO Tim Cook's 2014 earnings exceeded $9.22 million.	18	ok
4852317	People of various ethnicities have distinct facial features worldwide.	12	ok
4012161	Secondary headaches are symptoms of underlying medical conditions.	10	ok
5534315	Minimize distractions to help children follow instructions effectively.	11	ok
5183578	Goold Brown's Grammar of English Grammars discusses verb conjugation.	15	ok
6154967	Bring 6-8 quarts of water to a rolling boil.	15	ok
885117	Common eye concerns require regular exams for optimal health.	11	ok
3038341	Pensacola Beach to Destin Fl distance is approximately 27 miles.	17	ok
4317709	Bryan Stow recovers at home with family support.	13	ok
4589768	Medicare Supplement plans fill Original Medicare gaps effectively.	11	ok
1945161	Blue Crush 2 received negative reviews from critics universally overseas.	13	ok
3254062	Thessaloniki hosts annual gay parade amidst police violence issues.	14	ok
1991529	Attendees must follow all instructions from staff and law enforcement.	13	ok
5007847	Hyundai Blue Link offers remote vehicle control and location features.	13	ok
7705433	DNA is composed of sugar, phosphate, and four specific bases.	14	ok
596327	Canadian families pay significant taxes, including property and income taxes.	13	ok
4238880	Trust fund recovery penalty can be appealed with valid defense.	12	ok
6292563	Service animals assist people with various tasks and functions worldwide.	12	ok
6736446	Billy and Cody Lefever's oil discovery sparks ruthless competition and marriage.	16	ok
8769749	Adtunes is a leading advertising music guide resource.	12	ok
8568448	Vocal Hygiene Tips and Studio Locations are available online.	13	ok
4364498	U.S. Congress opposes EPA's efforts to limit emissions.	13	ok
1833116	Avast Safe Zone Browser offers enhanced security features.	11	ok
4758081	Pompe disease requires early diagnosis for optimal patient outcomes.	13	ok
7893764	Freezer storage method prevents freezer burn with proper packaging.	12	ok
939397	IMO number verification relies on its rightmost check digit calculation.	13	ok
4041891	OSHA accelerates push for workplace safety through new regulations.	13	ok
2323566	Venue's open bar package has limited hours during dinner.	12	ok
5512042	Alcohol concentration in a 155lb man's 6300mL of blood.	19	ok
4400485	Routers prevent network flooding and facilitate subnet growth efficiently.	12	ok
4065677	Corydon, Iowa, is a small city with charming amenities nearby.	16	ok
768844	Asking something or expressing doubt is a question.	11	ok
146454	US coins came in various bag sizes and quantities.	11	ok
5350797	Reaganomics is a supply-side economic theory with mixed views.	14	ok
6776857	Guatemala is a Central American country ruled by oligarchy.	13	ok
6558266	Consecutive events occur one after another without interruption.	11	ok
765033	Mirror neurons drive human evolution and social behavior development.	11	ok
4354520	Victoria Wood's 1989 series featured various individual stories.	13	ok
6027949	States previously imposed estate taxes with federal tax credits.	11	ok
7299076	Thyroid and parathyroid ultrasound examines gland abnormalities.	13	ok
6955466	Surgical technologists work in hospitals, offices, and outpatient centers.	15	ok
2740748	They will need 13 studs for a 24-foot wall.	14	ok
3022467	Working lines remain true to the German Shepherd breed's origin.	13	ok
7575489	Hackers defaced Wordpress website to exploit security vulnerabilities.	12	ok
4065923	Hospital staff receive varying monthly salaries based on experience.	11	ok
130290	Mint.com aggregates financial information in a user-friendly interface.	13	ok
7884178	American women's fashion trends shifted with the bicycle craze.	13	ok
1341264	Comparing Australian universities by size and composition nationwide.	11	ok
7928902	Apply for PTAN after accreditation to bill Medicare.	11	ok
6411248	Chris Tomlin's song is a heartfelt expression of devotion.	13	ok
1534350	Edge browser is slow and frustrating with Windows 10 issues.	13	ok
4634516	Metro Detroit Junior Hockey League emerged from Central States Hockey League.	13	ok
937376	Calculate adjusted body weight for obese patients over 60 inches tall.	14	ok
437127	Enter a strong Wi-Fi password under Wireless Settings securely.	12	ok
5211749	Individuals under 50 with limited work capacity qualify for disability.	14	ok
1902354	IBM Tivoli Monitoring Version 6.2 offers customizable real-time diagnostics.	17	ok
4998035	Korean and Irish versions feature non-native actor casts.	12	ok
3238369	Pyrethroid insecticides have varying environmental persistence durations.	13	ok
5928294	Seattle Seahawks popularized the tweener position in the NFL.	13	ok
5804176	Filed Under: Blood Donation, News. 1  Click to	14	ok
1930833	Standard sliding window sizes vary widely across different locations.	11	ok
1403153	Eating cruciferous vegetables reduces prostate cancer risk.	12	ok
5314215	Insurance regulatory law protects public as consumers and policyholders.	12	ok
2494274	Borehamwood is a London suburb with a population of 31,065.	18	ok
3942023	Configure employee working hours in Office 365 Bookings.	12	ok
7515921	Enter start time in cell B2, type space, and press Enter.	16	ok
8510100	Protein absorption requires digestion for body repair and growth.	12	ok
5898447	Alkanes are simple hydrocarbons with single carbon bonds.	14	ok
4924539	Longest minor league baseball game lasted 33 innings in 1981.	16	ok
4956088	Yazid's origin is Hebrew and Arabic, meaning 'he will increase'.	17	ok
1898960	Ellen DeGeneres hosts American daytime talk show since 2003.	16	ok
7967842	Rotator cuff tendonitis causes damage to rotator cuff tendons.	15	ok
285327	Border Patrol agents secure US borders with Mexico and Canada.	12	ok
219812	Elevated studio with lake views and mature trees surrounding.	13	ok
3884299	Mallard Pointe real estate offers great opportunities for home buyers.	15	ok
6478845	The World Trade Center complex had 12 million square feet.	13	ok
4842310	Developing social skills through community resources and leisure activities.	12	ok
1683147	Sergeant is a non-commissioned military or police rank position.	16	ok
7217906	Hartford weather data recorded by CustomWeather from February 4-19.	17	ok
2948401	Liver cancer treatment involves blocking blood flow to cancer cells.	12	ok
2364012	Microwaves may alter molecular structures without ionizing radiation.	13	ok
4521867	C.S. Lewis's official website offers books, newsletters, and resources.	16	ok
5145948	Weymouth railway station serves London and regional routes historically.	13	ok
2360545	Scientists discover simple laser method to regenerate dentin in teeth.	13	ok
2936832	New Lincoln penny features Union shield on reverse side.	11	ok
4890817	Tampa Bay Rays and Marlins to host 2017 All-Star Game.	16	ok
5309016	Homer reaches summit, pride and joy are short-lived briefly.	14	ok
3757661	Natural features of the earth's surface include various landforms.	13	ok
1457421	Upgrade to advanced, secure iCLASS Smart Card technology options.	13	ok
4832713	PowerShell modules simplify sharing functions and scripts effectively.	11	ok
293753	Becoming a medical records administrator requires specific education and certification.	14	ok
7895333	Labrador Retrievers mature mentally slowly, not physically.	12	ok
7148502	Natural foods promote healthier skin through various scientific research findings.	12	ok
4401723	Candies, milk chocolate Nutrition Facts & Calories. For best	14	ok
4388462	Proper post-workout nutrition is crucial for muscle recovery.	13	ok
19028	Plant-based diet may reduce gout risk and improve health.	13	ok
2059197	Win Pokémon TCG Online by commenting on daily reviews.	12	ok
1668086	Gingivitis is inflammation of the gum tissues surrounding teeth.	14	ok
8568333	Answer. 32% -- 32 for each 100.	14	ok
4294485	Havana has a warm, tropical climate year-round in Cuba.	14	ok
7046930	NCR average salary is $84,453, with a range	14	ok
430965	| PERIOD | | OF RECORD | JAN FEB MAR APR	14	ok
2354949	Edmund Burke, Anglo-Irish statesman and conservative political theorist.	16	ok
4079847	Organic compounds form basis of life and human endeavors.	12	ok
1953028	Infinite dimensional spaces lack compact unit balls.	10	ok
6592202	Small tattoos heal in about three weeks after getting them.	12	ok
239974	Examples of cash flow items are provided in the statement.	12	ok
6030886	Paul challenges Peter over forcing gentiles to follow Jewish customs.	13	ok
159830	Early childhood teacher applies for educational teaching position.	10	ok
1473760	Vanilla extract and flavoring differ in their usage and quality.	14	ok
3073762	Pharaoh hound prices vary greatly depending on age and quality.	14	ok
2004188	Incorporation provides liability protection, but requires proper completion.	14	ok
8127744	TACA serves as a leading industry resource and advocate.	12	ok
1799524	People can ask doctors online for free medical advice.	11	ok
1283306	Australian demands removal of British cricket team from their grounds.	12	ok
8809972	Define paraphrase. paraphrase synonyms, paraphrase pronunciation, paraph	14	ok
5065782	Antony spent his life in Delft after early education.	14	ok
2214024	Apply hair growth serum to eyebrows and eyelashes nightly.	12	ok
544945	Acupuncture and osteopathic manipulation relieved knee replacement pain.	12	ok
6736534	AKC agility has three levels of competition and a bonus system.	14	ok
4777413	Social theories guide social scientists' research and methodology debates.	12	ok
4328339	New Orleans celebrates African diaspora music and culture festival.	12	ok
1572566	Cayenne pepper relieves swollen prostate symptoms naturally.	12	ok
4686352	SPRIX is contraindicated in active peptic ulcer disease patients.	16	ok
1437307	Roth IRA withdrawals follow specific tax treatment guidelines always.	12	ok
2320001	Canada lynx is a small, elusive northern wild cat species.	14	ok
8509939	CSCS test is a 45-minute multiple-choice assessment.	14	ok
8310558	Nascar Cup Series driver earns points for winning and leading.	13	ok
2715278	Pertussis is a highly contagious respiratory tract infection.	13	ok
584287	Common cold is a viral upper respiratory tract infection.	11	ok
7576174	Heavy rain caused widespread flooding in Russia and Nankouqian.	15	ok
2942315	Literature often employs realism to connect with readers effectively.	12	ok
5570853	Richard Harrison turns 75, a milestone birthday celebration unfolds.	13	ok
4133627	Isramco acquires, develops, and explores oil and natural gas.	16	ok
7740017	Nintendo discontinues Wifi Connection service on DS and Wii systems.	13	ok
4188601	Router path selection depends on MED order of received prefixes.	12	ok
1240590	IGF-1 hormone regulates normal growth and tissue development.	13	ok
961784	Thirteen colonies declared independence from British rule eventually.	11	ok
3315650	Pine cones contain seeds without flowers or fruit naturally.	12	ok
6027179	Kansas City Royals are an American professional baseball team.	11	ok
7673381	The term gringo originates from Greek roots in Mexico.	12	ok
4343748	Schools were locked down for security reasons yesterday.	11	ok
7440686	End-user computing empowers users with control over technology projects.	13	ok
23730	Mesopotamia's history spans from Lower Palaeolithic to 7th-century conquests.	21	ok
7987369	Commercial use of captured footage is strictly prohibited.	10	ok
6248720	Conifers are pyramidal trees with single needle-like leaves and cones.	16	ok
4977269	Steve Lyles shares photo with Charlie Haddock at AT&T Field.	15	ok
2790390	Outpatient receives treatment at a hospital without overnight stay.	12	ok
2022405	Pituitary tumors are abnormal growths in the pituitary gland tissue.	18	ok
1521959	Mayo Clinic's Cardiac Rehabilitation Program improves heart health nationwide.	14	ok
8589176	Young people dropped out of school, left home with friends.	13	ok
1037084	Vitamin B12 is found in animal products and fortified foods.	14	ok
5489098	Designers' backgrounds varied greatly among the baby boomer generation.	14	ok
786832	Breast cancer often metastasizes to the axial skeleton initially.	14	ok
763948	Pollutants accumulate in specific environments as a result.	12	ok
6489219	He fought through treacherous terrain to save their lives.	13	ok
2799500	Julie London died in 2000 after suffering a stroke.	14	ok
5801744	Yellowstone Lake is a large, deep American lake.	12	ok
192123	Peonies require sunny, well-drained soil with good air circulation.	16	ok
6271384	Keflex dosage varies from 1 to 4 grams daily.	15	ok
2343398	Carbon monoxide molecule has 2 nuclei and 14 electrons.	14	ok
7093793	Lompoc, CA weather varies greatly from other US cities.	14	ok
4803980	You can achieve this using dynamic SQL queries. Here's an	14	ok
3264703	QR codes are machine-readable labels with location tracking capabilities.	12	ok
6079053	Samuel can roll over $5,000 into his RRSP tax-free.	17	ok
2865490	College investment yields varying salaries for different professions nationwide.	11	ok
7086490	Banana cultivars classified by chromosome number and ploidy.	13	ok
2658460	Proper storage keeps beets fresh for a longer period.	13	ok
8524551	Evil thoughts originate from a person's inner heart.	12	ok
6244801	Calcitonin regulates calcium and phosphate levels in bone remodeling.	13	ok
6536081	Daily carb intake varies by calorie plan and food source.	12	ok
6018811	SSDI and SSI have different application timing requirements.	12	ok
36436	Medicaid enrollees can access reproductive health services freely nationwide.	14	ok
8385967	Women can identify ovulation through changes in vaginal secretions.	13	ok
4648203	Teachers' pensions vary greatly depending on job tenure and salary.	13	ok
4535210	Kylie Jenner's provocative magazine covers and celebrity relationships.	12	ok
5557427	Tonic water with quinine causes adverse effects and fatigue.	13	ok
6804353	Sonic menu items are often high in calories and fat.	13	ok
1785447	Alcohol affects brain function and overall bodily health negatively.	12	ok
5835973	Above Ground Pools Experts offer custom portable pools nationwide.	12	ok
4517907	Use baited traps to catch small mouse populations effectively.	12	ok
5408541	Douglass' father's identity is disputed due to racial ambiguity.	14	ok
1240359	The U.S. fire department uses the Florian Cross symbol.	13	ok
2097839	Lidocaine relieves pain through topical or intravenous administration methods.	16	ok
1483914	Plant, animal, or microbial colouring matter and pigments.	14	ok
8358696	Taco Bell Crunchy Taco contains 170 calories per serving.	14	ok
6462859	Cardiac muscles contract and relax continuously throughout the year.	12	ok
8189625	Osteogenesis imperfecta is a congenital bone disorder characterized fractures.	15	ok
1615875	Maryland has unique income tax and relatively low property taxes.	13	ok
4946454	Ty Lawson signs 1-year, $1,315,448 contract with Kings.	18	ok
5674190	Cancer patients face financial challenges despite various available resources.	12	ok
1100647	Test Plan vs Test Strategy: Essential Documents for Testing Projects.	13	ok
7095176	Slidell, Louisiana's average climate data is available online.	14	ok
6685432	Gamma rays are non-thermal electromagnetic radiation from charged particles.	13	ok
7930344	Herbert and Jordan names originate from French and German roots.	13	ok
6482330	Create overlays for Twitch streams with OBS tutorials.	10	ok
8571073	Will Smith rose to fame as rapper and actor.	11	ok
5374825	Women's average IQ surpasses men's through mental exercise and life complexity.	16	ok
5984946	Earth Song was Michael's environmental awareness single from History album.	13	ok
5831014	Recreational boats with cabins or without.	10	ok
8753061	SECA law governs self-employment taxes for sole proprietors nationwide.	16	ok
4844062	IST to CDT time difference is 11 hours and 30 minutes.	16	ok
607500	Students can complete EMT training in various timeframes.	12	ok
4561167	Fujita scale updated to enhance tornado damage assessment accuracy.	13	ok
6346444	Find your ideal apartment at 10 Hanover Square online.	13	ok
8687699	Various services and fees are available for public records.	11	ok
5291898	The Arctic Circle experiences 24-hour sunlight and darkness annually.	13	ok
4907601	Japan's Respect for the Aged Day has ancient origins.	13	ok
2574758	Send invitations six weeks in advance for a stress-free wedding.	13	ok
5195056	Lagenlook is a layered, artistic, and nostalgic fashion style.	15	ok
858502	Bob Hope attended several high-profile events and award shows.	12	ok
2239373	Junior doctors face substantial annual professional and training costs nationwide.	12	ok
826839	Tampon use has hidden risks and potential health consequences.	12	ok
2732547	Nathuram's assassination gave Gandhi's life a new significance suddenly.	16	ok
2884480	Northern Mexico's climate varies greatly between hot and cold seasons.	13	ok
8354792	Bagel size and calorie count have increased significantly over years.	13	ok
5681231	Mathematical model studies heat and mass transfer in porous medium.	14	ok
1782927	Inmate population search by name or ID is available.	12	ok
6041943	Licensed Professional Counselors in the US provide psychotherapy services.	13	ok
1484350	Your lifestyle affects the environment through your carbon footprint significantly.	12	ok
4382992	Force affects mass and acceleration in physics problems.	10	ok
1638441	Paper dolls originated in Europe in 18th century.	12	ok
5662489	Banana Republic offers stylish petite clothing for the fashion-conscious woman.	14	ok
3481587	MIG-25 Foxbat holds record for fastest military aircraft speed.	15	ok
5123896	Tourmaline is a highly colorful gemstone with diverse hues.	14	ok
2676577	Dialysis guidelines vary by gender and individual factors.	12	ok
7535754	VAT registration requirements vary based on goods and services.	12	ok
99201	I agreed to run in Nike Roshe Run after illness.	13	ok
7396535	Dr. Marvin Resnik receives phone calls after shuttle launch.	13	ok
5984667	Scientists debate what constitutes a planet versus a brown dwarf.	12	ok
4249154	HP printers behave differently with Windows 7.	10	ok
3665609	Minor league baseball players face low pay despite legislation.	11	ok
5033804	Stokes County formed from Forsyth in 1849, research records accordingly.	17	ok
1778548	Allow yourself time to ease into the morning routine.	11	ok
1103875	All on 4 dental implants cost $15,400 with extras included.	16	ok
4629574	Dr. Michelle Thaller challenges simplistic views on a complex topic.	14	ok
5724554	Mutations in haematopoietic stem cells can alter their properties.	16	ok
6931005	Click on 'Get it' to access Steam trade URL.	13	ok
7642298	Employees are entitled to 6 weeks paid leave after miscarriage.	14	ok
4141578	Lawyer prepares and advises on contracts and major legal actions.	13	ok
739513	Life changes are distinct from daily hassles in nature.	12	ok
3190582	Muhammad book challenges fundamental paradigms with new historical insights.	14	ok
2306927	Ballard searches for Titanic wreck after months of failed efforts.	13	ok
3154175	Magnetic field induces emf in moving wire, north end positive.	15	ok
5402823	Tom Magliozzi and Elizabeth Norment have passed away recently.	15	ok
8158562	Alabaster skin is a timeless, coveted beauty ideal globally.	14	ok
2083220	Phantom Food Truck offers unique Asian fusion cuisine options.	12	ok
4799934	Military recruiters often overlook officer programs for enlisted roles.	11	ok
6726015	Mr. Heater's MH80CV produces reliable heat for 1900 sq. feet.	19	ok
1774211	Wife perceives difference in ibuprofen products, possibly due placebo.	16	ok
1470237	Retirement age varies from 62 to 70 years old.	14	ok
3223514	Notable individuals who have made a significant impact worldwide.	12	ok
7678485	Learn to draw realistic animals with step-by-step tutorials.	12	ok
720802	Use the SUM function to calculate total values in Excel.	12	ok
7435513	The goliath birdeater is the world's largest tarantula species.	18	ok
1727215	Formal tea gatherings often require deep tablecloth overhangs.	14	ok
8149425	Liberalism has multiple meanings and nuances.	10	ok
2557846	Egypt is home to the ancient Pharos of Alexandria lighthouse.	14	ok
2969645	Syndication is less common globally due to centralized networks.	13	ok
5036303	New Jersey Plan rejected as basis for US constitution.	11	ok
1659142	The central nervous system relies on neurons and glia.	12	ok
8594400	The Biggest Loser contestants weigh in at the start.	12	ok
1764941	Turmeric dosage can be simplified with a few simple guidelines.	13	ok
6499864	Local health department provides HIV testing services and support.	11	ok
5256559	Identify faulty heating element in hot water system.	11	ok
7607959	Benign syncope often occurs in children and young adults suddenly.	14	ok
2359751	Dogs eating poop may indicate underlying health issues.	11	ok
1674344	Medium dog's annual expenses average $354.30.	12	ok
5671709	Type in the persons cell phone number and you will be given access	14	ok
3925887	Skeletal muscle cells vary in contraction speed and ATPase rates.	14	ok
2748706	Regular maintenance can extend boat paint's lifespan significantly over time.	13	ok
5597602	Im not a 100% sure, but I think I may	14	ok
6758867	New Realism art movement emerged in 1960 with pioneers.	14	ok
442276	Economic risk is the likelihood of investment impact from macroeconomic factors.	15	ok
7036414	Troubleshoot Panasonic phone issues with steps to resolve.	12	ok
7395083	Acetaldehyde builds up in the blood and causes flushing.	13	ok
1872912	Blocking is used in wood framed construction for various purposes.	12	ok
5851178	Zinc lozenges release ionic zinc through a drying sensation.	16	ok
4949170	ZYXEL modem improves download speeds without NETGEAR router interference.	15	ok
1923809	Medical school applicants must consider grades, activities, and school choices.	14	ok
71177	Children's molars develop at different ages and stages.	12	ok
3742853	Dr. Anderson's book is available at AndersonSpeaks.com, his website.	17	ok
4385568	Classic dress shoes offer comfort and great style at Aldo.	13	ok
4070718	Bell's palsy symptoms vary in severity and facial paralysis.	13	ok
1667116	Wendy's Co. lost its way in recent years.	14	ok
5194511	Relative pronouns and clauses are reviewed in this chapter.	12	ok
8656340	Fabrics can be made from various natural or synthetic materials.	13	ok
8285748	Early miscarriage is referred to as a chemical pregnancy.	12	ok
7569647	Beats Music expanded into online music streaming in 2014.	14	ok
4924508	Weather data presented through a stylized iPhone window interface.	12	ok
2527221	US military operations authorized for Global War on Terrorism Medal.	12	ok
5205749	Genetic terms describe allele interactions and inheritance patterns.	11	ok
7119698	Phoenix search results mostly outside city limits nearby.	10	ok
1130254	Seats near the front of a building or vehicle.	11	ok
3930356	Angles around a point sum to 360 degrees always.	12	ok
1872097	Disability placards have varying validity periods for permanent and temporary disabilities.	15	ok
7986937	Russell Westbrook's high-energy play has mixed results in NBA.	14	ok
702153	Review of USB port driver.zip: Mixed performance and compatibility issues.	14	ok
437506	Scary phone numbers inspired marketing and pop culture phenomena.	12	ok
3726204	Beverley Randolph and Edmund Randolph held prominent Virginia positions.	13	ok
7409285	Human RANK Ligand is a 317 amino acid protein.	14	ok
4748769	The Zambezi River originates in Congo, flowing through Zambia and Wales.	16	ok
3698951	MRI Commercial Management streamlines multifamily management with property software solutions.	14	ok
2949931	Tammuz, a god, taught humans agriculture and was sacrificed.	15	ok
1326094	Catalysts speed up chemical reactions without being consumed.	12	ok
5180394	Create a new Steam account with $5 minimum balance.	12	ok
538868	Effective time management and organization are crucial for electrical engineers.	12	ok
963002	Inserting iPhone SIM card for mobile connectivity.	10	ok
839834	Prebiotic foods support digestive health and overall well-being naturally.	14	ok
5811156	Texas map highlights prison costs across 40 US states nationwide.	13	ok
6031318	Redeem digital copy with iTunes and redemption code.	12	ok
3779715	Gutter replacement services offer bulk discounts to customers.	11	ok
4874992	1. Gram-molecular mass of compound is 20 grams.	14	ok
6031433	Synchrony Bank defines key terms for Walmart accounts.	12	ok
2073258	Federal government employees rate top workplaces for civil servants nationwide.	12	ok
2506957	Getting calves accustomed to creep feed can be challenging.	11	ok
107951	Informal English uses short forms of auxiliary verbs frequently.	12	ok
3815079	Splat the Cat avoids library, but finds a surprise.	13	ok
526518	Lighting calculation involves lumens and footcandles.	12	ok
8178316	Men often wear moccasins with pants at Pow Wow events.	15	ok
3420720	Louisiana residents can renew documents online 24/7 with ExpressLane.	16	ok
2265420	DNA is a double-stranded molecule carrying genetic information.	12	ok
4640506	Pigeon Forge Rod Run 2015 at LeConte Center.	16	ok
4975542	Upgrading the pot size is recommended for plant growth.	12	ok
6199616	Max Mueller coined the term Aryan in 19th-century writings.	15	ok
6479894	For a sample of an entry from an annotated bibliography entry in PDF	14	ok
3358561	States can save millions by eliminating the death penalty nationwide.	12	ok
5167520	Replacing fuel injectors in a 2012 GMC Acadia can	14	ok
7475665	Blood samples are collected from specific veins with minimal stress.	12	ok
6646127	Small sailing vessel with two masts and rowed crew.	13	ok
3856712	Complement proteins are activated by various foreign substances in body.	13	ok
5161654	Texas A&M requires a minimum ACT score of 25.	13	ok
5646867	North-eastern population growth exceeds normal rates due to immigration.	13	ok
8415506	Used truck axles for sale online and various types available.	13	ok
