3310385	Element Miami International Airport offers convenient shuttle service nearby.	11	ok
5378673	Authorities oversee ARCA CONTINENTAL mergers and acquisitions carefully.	15	ok
5360166	To emphasize the eternal importance of the family and to help participants know	14	ok
7529640	Ola documentary series explores education through intimate, uplifting stories.	13	ok
7286210	The term HIPPO encompasses various organizations and concepts.	11	ok
7107610	Key elements of a story are essential for connection and value.	13	ok
8736173	US invaded Iraq, occupying for nearly eight years successfully.	12	ok
2666842	MyAnimeList ranks top 100 most popular anime series.	13	ok
4686397	Interviewing for a job in Grand Cayman with mixed expectations.	14	ok
920024	Cleanup efforts for hazardous sites and spills in Washington.	11	ok
3729763	Rhizaria and Archaeplastida are two supergroups.	14	ok
901657	EpiPen doses range from 300-500 Î¼g or 150 Î¼g pediatric.	22	ok
5721861	Students work on a term project with multiple parts afterwards.	12	ok
2782661	The aorta and pulmonary artery are the body's main arteries.	14	ok
5364479	The article helped clarify SMART goal setting for me.	11	ok
1004613	Consulting family and healthcare providers is advisable before admission.	12	ok
8762534	Adjust stimulator settings for muscle response measurement.	10	ok
2116543	Sebastian County Collector's online tax payment deadline is October 17.	15	ok
2845355	Lymphatic system stress causes swelling due to excess fluids.	13	ok
2197712	Median US ceiling tile installer hourly pay is $25.	12	ok
277081	Insert SD card, turn off, and press power keys together.	14	ok
4725374	She introduced potty training at 6 months old successfully.	13	ok
4494658	Spanish omelette made with potatoes, onions, and chorizo.	15	ok
6039580	Store medicine safely to preserve its effectiveness properly always.	11	ok
6509129	The Earth is significantly larger than the Moon.	10	ok
3243929	Massachusetts trivia questions cover various topics statewide.	10	ok
5501340	Sell your Holiday Rambler Endeavor Diesel RV quickly and fairly.	15	ok
5893174	Holographic security solutions for various products and labels.	12	ok
3879802	Damascus disincorporated, reverting to Clackamas County jurisdiction.	17	ok
5661255	Identical twins form from a single fertilized egg splitting.	13	ok
6892805	Apache Atlas project proposed to the Apache Software Foundation.	11	ok
3087468	Watercolor illustrations of 90 apple varieties in classic book.	13	ok
842122	Pneumomediastinum is often caused by lung or airway injury.	18	ok
5619797	Microwave potatoes to desired doneness with varying cooking times.	13	ok
6022935	Middletown Cpc Logistics provides local business search services effectively.	15	ok
8486608	Cheap access to Windows 7 is available through various options.	13	ok
2530122	Progressive Insurance offers free car quotes and 24/7 customer service.	16	ok
8781617	Guam became a U.S. territory after Spanish-American War.	14	ok
7865317	Wildebeest migration is largest mammal migration on Earth.	14	ok
3190654	Jennifer Lawrence is youngest three-time Oscar nominee at 23 years.	14	ok
3521444	Essential needs for survival and a good life.	11	ok
5695969	Silicon Valley defines geek as software or hardware engineer.	12	ok
3694032	The periodic table organizes elements by atomic number.	11	ok
4486693	Hidalgo Medical Services adapts to changing priorities and regulations.	14	ok
7831997	Countries with nuclear power use closed fuel recycling systems worldwide.	12	ok
5134941	Metals lose electrons, non-metals gain electrons to fill shells.	16	ok
4185589	Iceland's freshest ingredients used in modern, sustainable dishes daily.	15	ok
4631449	Northwest Trustee & Management Services in Spokane, WA.	13	ok
7409072	Buy Madden Mobile Coins securely and quickly on PlayerAuctions.	13	ok
6777485	We'll sell turquoise jewelry at a lower price point.	12	ok
7551093	SORTKEY settings determine column-level or table-level sorting rules.	13	ok
8438655	Delete browsing history on your tablet or computer device.	11	ok
4914995	Carbon is crucial to all living organisms through chemical reactions.	12	ok
4983887	Landlords can't waive no-pets policies for disabled tenants easily.	15	ok
6198357	Oklahoma City metropolitan area is the state's largest urban region.	15	ok
354730	Men's body fat percentage calculation requires waist circumference and weight.	13	ok
505781	Science encompasses various disciplines studying the universe and human societies.	12	ok
5751298	Downgrade to no-fee Delta card after Platinum card sign-up.	15	ok
765493	Coaching cheerleading can be a fulfilling yet challenging endeavor.	13	ok
5296751	Apply for Merchant Mariner Credential renewal process begins here.	12	ok
7342166	Burn calories with BodyPump aerobic strength training classes effectively.	13	ok
3528446	Mimi is a Hebrew name with biblical origins and meaning.	13	ok
7342117	Medical malpractice cases are complex and time-consuming lawsuits.	12	ok
8153565	Diabetic retinopathy is a leading cause of blindness in adults.	15	ok
2415332	Philosopher seeks eternal truth over fleeting sensory perceptions always.	12	ok
231526	Indigestion causes upper abdominal discomfort and heartburn symptoms.	13	ok
3990356	Ion movement across lipid bilayer is facilitated by embedded structures.	13	ok
4259366	Guns N' Roses' music video for Paradise City has been viewed millions.	17	ok
1928850	Becoming a qualified secondary school teacher requires initial training.	13	ok
1140120	Kylie is an Australian origin name meaning boomerang.	13	ok
6179444	The US Federal Court System handles appeals from state courts.	12	ok
3223829	Vehicle speed sensor informs the control unit of vehicle speed.	12	ok
2596255	Repeated cross-sectional studies obscure individual variability in growth patterns.	12	ok
7942776	The Culture and Media Institute promotes traditional American values.	11	ok
4050386	Learn Hozier songs with E-Chords.com's easy-to-use online resource.	18	ok
3766283	Protect your hands with gloves when using dry ice.	11	ok
1869397	Chief Operating Officer oversees company operations and makes key decisions.	12	ok
7648071	Moisturizer is a common ingredient in various personal care products.	15	ok
50134	Epithelial tissue forms a layer of cells covering surfaces.	13	ok
3381165	The immune system protects the body from pathogens and invaders.	12	ok
2053647	Michigan residents eagerly await warmer weather to fertilize lawns.	13	ok
6343955	The discipline of psychology is inherently diverse, encompassing a wide range	14	ok
72797	Phagocytic cells engulf foreign particles through a process.	13	ok
7908156	RIA experts offer insightful guidance for tax, accounting, and finance professionals.	15	ok
1210069	Lipsticks lack descriptive names despite misleading product names.	12	ok
3893727	Virginia's motor vehicle sales tax rate increases on July 1, 2013.	18	ok
78901	Carbohydrates are found in various forms in foods.	12	ok
5294048	Daughter's dilated pupils cause blurry eyesight and dizziness issues.	16	ok
3037246	Physical Therapist Salaries Vary by State and Region.	13	ok
1310503	US Treasury bonds are sold in lots of $1000-$1,000,000.	19	ok
6984160	The ocean is the vast saltwater covering most of Earth.	13	ok
3608879	Veterinary nursing provides supportive care for animals in veterinary practices.	13	ok
7894490	Shark Week features multiple shark sighting shows on the east coast.	14	ok
2708929	Pancreatic pseudocysts are painful fluid-filled masses.	13	ok
257826	Sintering is preferred for high-melting-point materials like tungsten.	17	ok
2009993	Protect irrigation system from freezing temperatures with insulation.	10	ok
4608654	Ibn al-Shatir was an Arab astronomer and inventor of Damascus.	17	ok
7036902	Immune cells utilize various substances to destroy invading microorganisms.	13	ok
3035255	Dr. Neeti Alapati is an experienced ophthalmology specialist in Saint Louis.	19	ok
8158082	Pastel surfaces vary in texture and tooth options.	11	ok
1712569	Net profit equals gross profit minus various deductions and taxes.	12	ok
6916114	BMW's logo combines Bavarian flag colors and airplane design.	13	ok
40555	Family therapy is a time-efficient problem-focused approach.	11	ok
8220860	Taye Diggs' country star Daryle Singletary passes away suddenly.	18	ok
4458928	Facebook is the second-largest social networking site globally.	11	ok
1985729	Data independence allows schema changes without rewriting application programs.	11	ok
6367226	Many unexpected animals are listed as endangered globally.	10	ok
1106330	Living will and durable power of attorney for medical care.	12	ok
4950196	Scott Eastwood showcases humor at The Longest Ride premiere.	13	ok
3812610	Search warrant is a written order to search for property.	12	ok
2559503	Randy hesitated about being too candid with Julie suddenly.	13	ok
5709371	Bromhexine treats respiratory disorders with mucolytic properties.	14	ok
5754709	Asthma and Sinus Infections are Common Pregnancy Complications.	15	ok
4073477	Faye's store closes after 50 years with sale.	13	ok
4047001	NEX-7 outperforms A77 at high ISO settings slightly.	16	ok
8588573	A measure of cardiorespiratory endurance reveals aerobic fitness levels.	14	ok
76899	Federal tax law is governed by the Internal Revenue Code.	12	ok
2254151	Active person or thing that performs a specified action.	11	ok
3164060	DSL installation includes standard wiring and circuit identification process.	11	ok
6203704	Panda has multiple meanings in Japanese culture and language.	12	ok
5196601	K&L offers rebuild kit for XS11 fuel petcocks.	15	ok
8570205	Undertaker definition varies across multiple languages and dictionaries.	12	ok
3849077	Healthcare marketing shifts from B2B to B2C with evolving framework.	17	ok
5251242	Airmen receive 42-day convalescent leave with restricted PC testing.	17	ok
5404737	NPI number updated on June 10, 2016, for Accredo Health Group.	20	ok
1977530	Tesla's tile alternatives are expensive, exceeding $70,000.	14	ok
5285178	Perla is a relatively common US given name.	11	ok
1750275	Microsoft Visual FoxPro ODBC Driver facilitates data access and integration.	14	ok
5083726	Entertainment at its best, VideoBash offers hilarious clips online.	15	ok
4862439	Join Proactiv's growth with its revolutionary anti-age products globally.	14	ok
8260948	Contractor's license issued in exact name on financial statement.	13	ok
4406767	Use a breastfeeding pillow for bottle feeding comfortably.	10	ok
8124905	PurErb balms and oils enhance facial massage for rejuvenation.	16	ok
4252107	Vitamin C has multiple health benefits and functions.	11	ok
5478631	Dan Mallory trains apprentices at Allied Plumbing for four years.	13	ok
4426257	PhD graduate working on kidney cell profiling research.	11	ok
2256905	Thenar muscles form the thumb's ball-shaped thenar eminence structure.	16	ok
6210637	Kidney tubes carry urine to the bladder and then outside.	13	ok
5884276	Shema is seventh son of Elpaal and Shaharaim.	15	ok
8038373	Casting wisdom to those who will reject it harmfully.	13	ok
4396442	CLDRC research estimates dyslexia heritability at approximately 50 percent.	18	ok
1137791	Perfect competition exists in a market with many suppliers.	11	ok
8840881	Forks, Washington has a low sex offender ratio compared nearby cities.	15	ok
5741456	Tardive dyskinesia is a rare, involuntary body movement disorder.	17	ok
6804666	Brennan's visit may provide Russian officials with a pretext.	14	ok
3961783	Craft harralander tar in Poison Waste using Tirannwn tar.	16	ok
4409456	The Office of the Under Secretary of Defense oversees acquisition efforts.	13	ok
744773	Weak batteries can render watercraft nearly unusable or unresponsive.	14	ok
3904261	Secure panel with clamps and cut with a circular saw.	13	ok
4336193	The pound sign has different meanings in US and Canada.	12	ok
7289967	The US war strategy is mismatched with its mandate.	12	ok
3700818	Self-sustaining systems continue without external assistance or intervention.	13	ok
742236	Roasting a perfect chicken requires specific kitchen tools and techniques.	13	ok
7375818	Nosology is the science of classifying diseases in medicine.	13	ok
7408934	La Leche League advises against ketosis for breastfeeding mothers.	13	ok
6807762	Replacing Porsche Cayenne fuel pumps requires panel access underneath rear seats.	14	ok
8493820	Walton family expands Arvest Bank's assets significantly.	12	ok
5773576	Cosmetologists' salaries vary greatly within the industry nationwide.	13	ok
4682602	Tie horses to sturdy trees at night for safety.	12	ok
4685685	Appetizers and words related to pleasing the palate.	12	ok
1165314	Warranty details for product repairs and customer support.	11	ok
3230788	You've transformed your T-shirt into a trendy crop top.	13	ok
2526612	Vehicle license plate replacement fees vary by single or pair.	12	ok
8007994	Construction loans have fixed interest rates and varying terms.	11	ok
8087383	Merriam-Webster cites online news sources for virtual examples.	15	ok
6971088	Conjunctivitis is inflammation of the eye's outer layer.	15	ok
4009012	Flexible financing options for automatic standby generators and HVAC systems.	12	ok
3160421	Buyer pays rent, with a portion credited towards purchase.	13	ok
7950539	Serena Williams wins seventh Wimbledon title, equals record grand slam.	14	ok
7721348	Keratin treatment reduces blow-dry time by 40-60%.	16	ok
8096809	Ion channels play a crucial role in neurologic disorders treatment.	13	ok
7755002	Primary care providers aid in bladder cancer diagnosis and referral.	12	ok
470149	Taxpayer pays taxes on capital gain from property sale.	12	ok
5450920	Herbal extract capsules made from Justicia Genderussa leaves available.	15	ok
8626765	Hydrometer measures liquid density by floating in different liquids.	13	ok
6493487	Vornado continues to innovate nursery air circulation systems since 1945.	15	ok
2883523	Installing a range hood vent system was too expensive initially.	12	ok
814619	Israel is a country in Asia, near Africa and Europe.	13	ok
6056297	Scott Perekslis took significant risk in his venture.	12	ok
7761109	True morels have various colors and cap shapes naturally.	12	ok
3364175	Identify My Computer on Desktop to access drive information.	12	ok
8670205	Wineries in the US cost $219,000 to $75,000 minimum.	18	ok
7435470	Zithromax side effects may include various unforeseen reactions.	14	ok
8671100	Microsoft releases Windows 10, Dragon NaturallySpeaking 13 support.	14	ok
1487782	Thai government restricts freedom of expression for national security purposes.	13	ok
2678118	Red Mango in Dallas, TX offers dessert and yogurt.	12	ok
2557196	Researchers tested LSD in animals for potential medical uses.	11	ok
2458132	Silk Road religions differ in proselytizing or non-proselytizing nature.	20	ok
5582209	Hispanic and Muslim consumers prefer young goat meat options.	12	ok
6768043	Median and quartiles are calculated from sorted data points.	12	ok
1834810	Fuwa, China's Olympic mascots, symbolize friendship and global unity.	17	ok
3379063	Ronald Reagan's early life shaped by his family's economic struggles.	15	ok
6253508	Audience attention span is approximately 7 minutes long.	12	ok
5830548	Use 3% hydrogen peroxide for dental hygiene and baking soda.	15	ok
1231799	Conifers are evergreen trees with cone-bearing characteristics.	12	ok
7362476	Fares vary based on distance and traffic conditions nationwide.	12	ok
2027049	Brake pad and rotor replacement costs vary widely nationwide.	12	ok
4438531	US airline passengers entitled to $1300 compensation for delayed flights.	14	ok
3274226	Power auger costs vary greatly depending on size and materials.	13	ok
7990679	Students must purchase specific coding books for AAPC exams.	12	ok
7942733	Regions Bank uses routing number 062000019 for ACH transfers.	15	ok
6304569	Carefully budget for bathroom remodeling costs and demolition expenses.	12	ok
3436790	Denmark's smallest coin is the 50-øre, valued at half a krone.	20	ok
5987398	RADIUS encrypts passwords, while TACACS+ encrypts all data.	17	ok
1374574	Fertilizer labels display three key nutrient amounts clearly stated.	13	ok
6782889	Cooking time for ham varies by its size and temperature.	13	ok
2105124	Theatre programme typically includes cast, scenes, and production history.	14	ok
8449183	Care for US Floors Coretec luxury vinyl plank flooring properly.	13	ok
7548822	Parking in Amsterdam requires prior payment and registration.	10	ok
2709957	Stavanger is Norway's third-largest city and metropolitan area.	14	ok
3020521	Catholic funeral practices prohibit certain items for cremation.	12	ok
7265288	Maui offers numerous beautiful beaches with amenities nearby.	11	ok
8415367	Waller County Appraisal District appraises properties according to Texas law.	15	ok
7527010	Florida Prepaid College Plan helps families save on tuition costs.	13	ok
3466824	Artist's introspective album captures emotional depth and creative connection.	13	ok
2146116	Experienced FAA Flight Attendants sought for supervisory roles nationwide.	14	ok
4416726	Symptoms of liver and kidney toxicity and overwork.	12	ok
5771953	Michigan 52nd District Court uses videoconferencing for court proceedings.	16	ok
3933247	Tenders must deliver specific tasks within agreed costs and time.	13	ok
4180093	Smurfette lacks a defining characteristic in the franchise.	12	ok
536052	Public Health Foundation develops performance management toolkit examples.	10	ok
6560401	SoFi offers low-interest student loan refinancing options for borrowers.	14	ok
8434994	Senior Accounts Payable Specialist salary varies by jurisdiction significantly nationwide.	13	ok
751336	Rural properties for sale in Prior Lake, Minnesota available.	13	ok
6979078	EMV is a global standard for secure payment cards.	12	ok
4878778	Synagis should not be given to allergic or bleeding children.	14	ok
8664911	Comedian Avila attacked with a baseball bat during performance.	13	ok
4829382	Treatment for underbites depends on severity and patient age.	13	ok
2760116	Sunny Baudelaire is a main character in Lemony Snicket series.	18	ok
471909	Amplitude and frequency affect sound's loudness and pitch.	13	ok
1847874	Person A asks Person B where they are going.	11	ok
8648743	Food options available at the Museum include McDonald's and more.	13	ok
3222299	Tour de France features mountainous stages with challenging climbs.	12	ok
948760	Post-Frame Buildings are versatile and suitable for various needs.	13	ok
6837891	Osteoporosis causes weak bones that break easily over time slowly.	15	ok
2977896	Seasonal changes explained through solar system motions.	10	ok
6886383	Oceanic zone hosts diverse marine life from top to bottom.	13	ok
2652228	Stretch calf muscles by leaning against the wall.	10	ok
1754102	Chromatography separates pigments using Greek roots 'chroma' and 'graphein'.	22	ok
5349039	List of world continents by population totals available.	10	ok
5259483	Coastal marshes exist between barrier islands and high tide line.	15	ok
4778633	Select Census Tract from your address to view its details.	13	ok
3972578	MTU is crucial in data transmission and network routing.	12	ok
3213477	Gunpowder is a mixture of sulfur, charcoal, and potassium nitrate.	17	ok
990756	Toyota's new CVT uses an engine-driven oil pump for transmission lubrication.	17	ok
6533105	The lower-seeded team hosts the higher-seeded team in playoffs.	15	ok
4693434	Victims were swindled by a man in a uniform.	14	ok
2235039	Nightwing faces a thief from the future in Jump City.	13	ok
1080117	Erythema encompasses various conditions related to redness and inflammation.	15	ok
3146661	Afghan refers to people, textiles, or a breed.	13	ok
7821745	Popular tattoo spots for women include ankles and lower back.	12	ok
426374	Blake Shelton's tattoo has a surprising, more complex origin.	14	ok
2738062	DACA program approval figures were initially incorrect and outdated.	12	ok
834194	Koala is a marsupial native to Australia.	13	ok
2739728	Safflower oil may help alleviate skin conditions and menstrual issues.	14	ok
8152172	Human hearing is most sensitive in 2000-5000 Hz range.	16	ok
8134166	Gymnopaedia originates from ancient Greek words for naked and game.	16	ok
7900335	Iceland is a prime puffin breeding ground in May August.	14	ok
7740821	US volcanoes have produced large and potentially hazardous eruptions recently.	14	ok
2880924	Jonathan Rhys Meyers joins Vikings for its fifth season.	13	ok
7339622	Cardiac event monitors record heartbeats for extended periods daily.	14	ok
8583467	Racism persists in America despite socioeconomic status.	11	ok
1541565	Pembroke digitizes tax maps in various formats online.	13	ok
3202819	Nail technicians earn lower salaries compared to other social services jobs.	14	ok
1231452	Liver damage from various causes can lead to cirrhosis.	13	ok
7603549	Creighton's Doug McDermott faces Louisiana's Elridge Moore and Shawn Long.	18	ok
2596065	Talk through daily activities to enhance language development.	10	ok
6051736	Monthly publication delivers solutions to noncommercial foodservice professionals nationwide.	13	ok
1315229	Hawaii DMV offices provide various driver services statewide.	12	ok
2232743	Younger relatives played bingo with 27 numbered boxes.	12	ok
8050697	Christ's yoke brings rest, satisfaction, and inner contentment always.	16	ok
5868342	Nutritional comparison of three dishes with varying calorie counts.	12	ok
5387434	ATPase motor protein transports organelles and molecules along microtubules.	18	ok
1246411	Manual returns may take 12 weeks or longer to process.	13	ok
2386696	Family of hosts mistaken for homeless people multiple times.	11	ok
7481132	Pineapples are fragile after reaching full sugar content.	13	ok
3603780	Channel 14 operates various US TV stations nationwide.	11	ok
363716	Bandwidth refers to data transmission capacity and project resources.	12	ok
492346	Vehicle owners should replace air and oil filters regularly.	11	ok
8341585	Opioid withdrawal is a major reason for relapse and abuse.	15	ok
6434210	Phallic stage of psychosexual development and related concepts.	13	ok
5269051	In 1930's Hollywood, the powerful agent, Phil Stern	14	ok
7633856	Philadelphia was a major US industrial and architectural hub historically.	12	ok
514108	Plaintiff must prove four elements of defamation claim successfully.	13	ok
8197538	Study thermocline with flashcards and various educational resources effectively.	14	ok
2237558	I'm between small and medium bike frame sizes.	11	ok
535334	Auditors use specific ISO standards for audits and auditees.	14	ok
703892	Evening primrose oil helps alleviate hives with no side effects.	15	ok
3911150	Adult males typically void 13-20 fluid ounces after urgency.	14	ok
6265696	Barn home kits include materials and construction costs.	11	ok
5907248	User concerned about data usage for streaming and downloads.	11	ok
4493751	Eliminating the Electoral College system is a presidential goal.	12	ok
6133264	Oasis offers stunning views and serene atmosphere near Lake Travis.	13	ok
5064311	Houston is the fourth largest US city and metropolitan area.	12	ok
8778855	Salem Village witchcraft hysteria fueled by Puritan fears and superstition.	16	ok
4522896	Hybrid cars save gas with electric power at low speeds.	13	ok
8159733	Significant association found between anemia, sex, and thrombocytosis in IDA.	21	ok
306571	Patrick Sturbelle, FAA Director of Quality Control and Chief Inspector.	15	ok
426337	Knowledge retention is crucial before employee departure occurs naturally.	11	ok
8041069	Cook onion, salsa, and chicken mixture in skillet until thick.	14	ok
7010329	Eucalyptus oil has antiseptic properties and germicidal qualities.	18	ok
2615541	The Earth's atmosphere has four distinct layers.	10	ok
4207444	Bladder infections are common in women, requiring medical treatment.	13	ok
7661476	Addiction is a physiological response to repeated substance use.	12	ok
6779863	Free research papers and essays available online now.	10	ok
1606259	Concepts are abstractions from experience or transformed ideas.	12	ok
1289406	Zantac is generally safe during pregnancy and breastfeeding.	12	ok
1583548	Denver's median income is lower than state and national averages.	13	ok
6004771	You still possess the class ring as a symbol of care.	13	ok
5460127	To make rock candy, mix sugar and hot water together.	13	ok
4784600	Altruism is pure selfless helping behavior motivated by concern.	14	ok
2542128	Spectrophotometers measure optical density of bacteria growth.	13	ok
1501590	Baby copperheads are more lethal than adult copperheads typically.	13	ok
6118779	Revenge can prevent future harm, but often leads suffering.	13	ok
277309	Provide health insurance card and employer forms for verification.	11	ok
2546112	CMOs must stay up-to-date with rapidly changing SEM landscape.	14	ok
4257987	Nixon discusses break-in with Haldeman and CREEP director Mitchell.	17	ok
3477849	Gamers outraged by Xbox One's paid web browser feature.	13	ok
6439047	Patients should receive a booster dose of PPSV23 at 65.	16	ok
1611699	Passive activity losses are limited by passive income.	11	ok
5236888	Most kidney stones pass with adequate hydration and medication.	11	ok
404932	U.S. embassy services severely limited in Crimea due restrictions.	13	ok
3966644	Wong's chances are somewhat improved by MHL Consortium backing.	14	ok
2052645	The Cenozoic Era spans from the Tertiary period.	14	ok
5115286	Family Support Workers earn $30,758 per year typically.	13	ok
8293248	Nectarines are a low-fat, nutritious fruit rich in carbohydrates.	15	ok
1460381	Polynomials are sums of variables and exponent expressions.	11	ok
5228352	Liv and Maddie was initially planned as Bits and Pieces.	13	ok
8280899	Country Region Basic Support ProSupport. Anguilla ABU*	14	ok
8320316	Sensory hypersensitivities after brain injury require identification and coping strategies.	17	ok
2757184	Use the Scan app to scan documents or photos easily.	12	ok
2860305	Jack Dorsey is a renowned American programmer and entrepreneur founder.	13	ok
7693593	Federal income tax calculation depends on multiple personal factors.	11	ok
