5109261	Access thousands of quizzes with immediate free access options.	11	ok
1509949	Spondylosis affects neck, upper/mid back, and low back areas.	19	ok
1142968	Burning excess calories through exercise and diet is key.	12	ok
5772744	Metro PCS accepts Sprint and Verizon phones with a fee.	12	ok
279031	We are Partners in Caring for our neighbors and communities.	13	ok
2587633	David McKay is a versatile and experienced multimedia journalist.	11	ok
1103510	Protists cause various human diseases through insect vectors worldwide.	12	ok
8245607	Bushnell AR Optics Drop Zone features side focus parallax correction.	15	ok
3036291	Tamoxifen may treat manic phase of bipolar disorder.	12	ok
1272966	Credit card minimum payments can lead to interest charges.	11	ok
4802516	Frequency is entered as an array formula in adjacent cells.	12	ok
1834347	The Red Sea symbolizes Divine judgment against wickedness and evil.	14	ok
2854377	External factors significantly impact an organization's growth and survival.	12	ok
2196211	Bitcoin's blockchain is an open, distributed ledger verified by consensus.	14	ok
530769	New Jersey resident's tax credit calculation complexities vary by jurisdiction.	13	ok
4761062	Lexiscan may cause anxiety in some patients temporarily.	12	ok
3566053	Federal Advisory Committee Act governs non-federal employee advisory groups.	14	ok
7968899	Modify existing ASA configuration from factory default settings.	10	ok
1323841	Nexium's OTC version is now priced similarly to Prilosec.	18	ok
8078329	Praise someone or something for their admirable qualities highly.	12	ok
1782213	Hyperbaric oxygen therapy eases symptoms after treatment sessions.	13	ok
6053250	Acupuncture effects vary in intensity and subtlety over time.	14	ok
1328530	Poltergeist in dreams signifies problems or impending poverty.	12	ok
765470	Knot refers to a cluster or fastening formed by tying.	14	ok
3040987	Allen Iverson wears a basketball sleeve in a game.	12	ok
5734836	The authors Joshua Fields Millburn and Ryan Nicodemus write about minimalism.	17	ok
2189895	Device administrators manage device policies and registration requirements.	10	ok
2582712	Wool garments require gentle washing and fabric care.	11	ok
582536	Scholastic Reading Clubs offer affordable books and resources.	12	ok
1096529	Glucagon regulates body's sugar and fuel balance naturally.	13	ok
5095690	Get a free year of UFC Magazine with FIGHT PASS subscription.	14	ok
3570869	Bone cancer affects sternum, ribs, and clavicle primarily.	15	ok
8381221	Geologic time scale is divided into eons and eras.	14	ok
5105113	The term disposed refers to a tendency or inclination.	11	ok
8180377	Haiti's slaves successfully drove French forces, gaining independence.	14	ok
5528302	Traveling to Sint Maarten in October, exploring alternative accommodations options.	16	ok
6474514	Seek medical attention immediately after a minor head injury nearby.	12	ok
5284623	Aldi offers high salaries to train student managers.	12	ok
5134307	Tone dialing replaces rotary dialing in 1963 nationwide.	15	ok
6021166	Perimenopause is a hormonal transition before menopause onset.	13	ok
4502292	Many notable actors star in a deadly hunting film together.	12	ok
6116189	Gabapentin and pregabalin treat seizures and neuropathic pain.	16	ok
4476697	New York City's population density is approximately 29,938 people per square mile.	18	ok
65122	Eating before a workout affects blood amino acid levels.	12	ok
2501574	Toyota's M family engines featured cast-iron blocks and aluminum heads.	15	ok
1317624	Business broker facilitates mergers and acquisitions with professional networks.	12	ok
46496	Abdominal pain can be caused by various internal issues.	13	ok
4386630	IBS is a gastrointestinal disorder with various painful symptoms.	12	ok
3480900	Electricity usage is calculated in kilowatt-hours and watts.	14	ok
2574951	Employers verify applicant documents and retain for three years.	12	ok
5108271	Haitian soldiers honored with Savannah monument after 228 years.	14	ok
7562163	US Constitution reserves power to states, leading to diverse relations.	13	ok
6420586	South Madison, OH real estate listings and local information available.	13	ok
3381072	Precocious puberty affects children's physical and emotional development.	12	ok
7699670	Insights emerge from processing and analyzing big data effectively.	12	ok
6794938	Steep yield curve indicates rising short-term interest rates.	12	ok
7613748	Nuclear plants use fission to generate heat, unlike fossil fuels.	15	ok
2597352	Factors to consider when choosing guttering include cost and material.	13	ok
958157	Southwest wind expected with 40% chance of scattered thunderstorms.	15	ok
2901107	Political economy emerged from Greek roots of home and law.	12	ok
5453343	Assemble pipe and fitting, then wait 2 hours at 60°F.	17	ok
8132258	Buying domains is quick and easy online with Sedo assistance.	13	ok
2106650	The 4 Drawer Fire File Cabinet reduces stress and protects documents.	14	ok
3584451	QuickBooks company files can be saved anywhere safely.	11	ok
3051416	Avocado toast with egg is a versatile breakfast option.	12	ok
5758117	Birth control pill is a highly effective yet imperfect method.	12	ok
6860620	Provogue is an Indian clothing retailer with diverse product lines.	13	ok
8168787	Cathedrals featured impressive bell towers and architectural designs.	13	ok
6536072	Eutrophication is a pollution problem caused by excess nutrients.	14	ok
7663330	Dunkirk is a commune in northern France near Belgian border.	14	ok
8445797	Wimbledon 2014 prize money reaches £1.76 million.	15	ok
2430929	Calculate tiles needed by multiplying floor area by 1.1.	14	ok
5029440	Potassium channels increase resting neuron permeability significantly greatly.	12	ok
3943067	Set Outlook 2007 as default email program via Options.	13	ok
3217272	^ Polish ^ > Polish pronunciation >. As an initiation to Polish	14	ok
3568486	American Kennel Club renames German Shepherd breed during wartime.	13	ok
4284289	Oliver Cromwell becomes Lord Protector of England and Ireland.	13	ok
8821190	The Camino de Santiago is a medieval Spanish pilgrimage route.	13	ok
6926273	Verify friend requests through direct contact or mutual connection.	11	ok
5696005	Guard breeds contribute to loud, persistent sound over time effectively.	13	ok
524018	Restless leg syndrome and heat exhaustion have distinct symptoms.	12	ok
1800085	The Scottish flag features a white X-shaped cross on blue background.	14	ok
2640944	English suffixes describe irrational or abnormal persistent fears.	11	ok
2990026	Abby Lee Miller faces bankruptcy and verbal criticism allegations.	12	ok
6962804	ICD-10 codes use 7th character for specific clinical details.	16	ok
5895957	Chicago Navy Pier hosts fireworks displays on summer evenings.	11	ok
2722095	Andorra's culture blends Catalan heritage with rural traditions.	12	ok
8456126	Malar refers to the cheek, measles is a viral disease.	14	ok
7590534	AT&T upholds integrity for over a century consistently.	12	ok
1469258	Trump sues ex-wife for breach of prenup in Florida.	15	ok
2967974	Sheboygan property owners benefit from fair and efficient assessments.	13	ok
7836137	Valuation allowance reduces deferred tax asset value on balance sheet.	13	ok
3502388	Character data has a minimum and maximum length limit.	11	ok
6673938	Replace Air Bleeder Assembly on Pentair Triton 2 Filter.	15	ok
5175600	Discuss major with transfer counselor for guaranteed admission benefits.	11	ok
6714580	Lebanese garlic sauce recipe yields best results with three heads.	14	ok
78494	Trench warfare characterized by attrition and stalemate in conflict.	14	ok
4543222	Moment of Inertia, First Moment of Area, and Second Moment of Area differ.	18	ok
714719	Optimizing resource allocation for global peace and prosperity.	12	ok
2663407	Coramae Richey Mann was a vocal critic of US justice.	16	ok
3453736	Excessive sweating and leg swelling in a 30-year-old mother.	15	ok
2648772	ACSA supports over 700 community organisations serving 450,000 Australians.	16	ok
5507116	Refund payment within 180 days of payment status change.	13	ok
5809336	Steve Wynn is interviewed by John Katsilometes at Wynn Las Vegas.	19	ok
8012107	Biological processes follow 24-hour cycles driven by internal clocks.	14	ok
8318352	Flight training duration varies by school and individual needs.	11	ok
47369	RF levels indicate RA severity and prognosis in patients.	11	ok
3658102	Dress shirt size is based on neck measurement range.	12	ok
7406693	Empowering children to read challenging material through sound and context.	13	ok
4834841	Excel tutorial covers formatting cell text in older versions.	11	ok
1781597	Groomsmen wear gray suits, bridesmaids wear pink dresses.	15	ok
2212750	Remove Pokki Start Menu from Windows operating systems.	11	ok
4158876	Assessing adolescents' pain on postoperative day one thoroughly.	14	ok
850238	Glucagon increases blood glucose levels through glycogenolysis.	14	ok
6220069	Debates rage over optimal diet choices for weight loss and health.	15	ok
336851	Learn fire safety and prevention for a safer home.	11	ok
8339617	Typically, a 5-20% deposit is required for a house purchase.	18	ok
7301933	Medical, product, and contract liabilities are common risks.	12	ok
345512	Foundation Room at House of Blues New Orleans offers unique dining.	13	ok
1707349	Breakthrough bleeding has multiple potential causes beyond hormonal fluctuations.	12	ok
1429545	Clean and disinfect the tub with hot water and bleach.	13	ok
725429	Researchers use brain interfaces to control devices remotely.	10	ok
5966069	Verizon's Layer 3 MPLS provides scalable, integrated network connectivity.	16	ok
3850230	Kia Niro hybrid SUV to be released later this year.	14	ok
6256722	Menthol cigarettes are misleadingly marketed as healthier alternatives.	13	ok
741891	Avocado and Macadamia Oil Body Wash for radiant skin.	14	ok
382043	Grasshopper offers local and toll-free numbers for small businesses.	15	ok
1648395	Culling refers to removing undesirable elements from a population.	12	ok
6170470	Afrika Korps, a German expeditionary force, fought in World War II.	18	ok
1950465	Commission issues licenses to qualified applicants meeting minimum standards.	11	ok
7561759	The United Arab Emirates Dirham is the UAE's official currency.	14	ok
8748318	Guatemala gained independence in 1821, followed by instability afterwards.	15	ok
3570108	Joints allow various movements in different planes and planes.	12	ok
4366076	High blood pressure weakens BBB due to various factors.	12	ok
1034350	Statistics involves numerical data and its applications in business.	11	ok
7676629	MSU professor finds mineral-rich water beneficial for health.	12	ok
7836632	Cook green onion and garlic in butter mixture slowly.	11	ok
712873	Mouse is a small device or animal with a pointed nose.	13	ok
2919014	Oregon parents learn proper car safety techniques during National Child Passenger Safety Week.	15	ok
6827206	Absinthe is the primary jailbreaking tool for iOS devices.	14	ok
3275017	Pilot job resources and career development support available online.	12	ok
6918496	Avatar's Na'Vi subscribe to panentheistic worldview rooted in experience.	17	ok
1914348	Nissan LEAF achieves remarkable 126 miles per gallon efficiency.	14	ok
7155543	Reaching 150+ on each part earns GED credential and Honors score.	18	ok
2076720	Thawing and refreezing meat is generally considered safe.	14	ok
8081758	PVIFA is a financial term for Present Value Interest Factor for Annuities.	17	ok
3027555	Dysautonomia affects nerve pathways to various bodily organs.	14	ok
1737386	Wells Fargo notifies customers of deposit holds via multiple channels.	13	ok
262976	National Incident Management System serves the entire community nationwide.	11	ok
4934066	Common eye issues in dogs include discharge, glaucoma, and ulcers.	17	ok
8327185	Hay fever relief options include nasal sprays and oral medications.	13	ok
4849083	Single or married with limited income or no secondary income.	12	ok
2245772	Researching hand/eye dominance on free throw accuracy in basketball.	14	ok
3545529	Flax seeds can be planted in early spring successfully.	12	ok
2674620	Average American family spent 2.8% on clothing annually.	14	ok
2331068	U2's 2015 Innocence + Experience Tour visited multiple cities worldwide.	17	ok
414177	Pawnee, Indiana, setting of NBC comedy series Parks and Recreation.	16	ok
895082	Mississippi dental insurance offers basic health benefits at a fixed rate.	14	ok
7635734	Laser operates on a single Gaussian transverse mode.	12	ok
64085	Man falls at approximately 25 feet per second.	11	ok
6073305	Construction costs vary greatly depending on location and finish.	11	ok
352148	Heart rate changes with varying levels of noise.	10	ok
8791839	LATISSE side effects include itchy and red eyes temporarily.	14	ok
1842821	PayPal is a widely accepted online payment method.	11	ok
4009329	Granite is a light-colored, coarse-grained igneous rock formation.	16	ok
4414393	CERAMENT|BONE VOID FILLER accelerates bone healing with biologic properties.	20	ok
3209548	Format for Reference List and In-text Citations.	11	ok
465439	Money laundering's final stage involves reintegrating funds into legitimate sources.	15	ok
495390	Eggs cooked in plain water were relatively easy to peel.	14	ok
4672773	Zinc forms binary alloys with many metals and other elements.	13	ok
8666933	Antibiotics-induced liver damage treatment varies by agent and patient factors.	15	ok
8700546	Church Hill real estate listings offer more than just numbers.	12	ok
2354315	Abdominal myomectomy carries rare but serious post-surgical risks.	16	ok
8414236	UK caravan mains lead with 16A site plug and cable.	14	ok
5623530	Travel speed options range from 7.3 to 11.1 MPH.	17	ok
1169848	Candidiasis is a fungal infection caused by Candida yeast.	15	ok
1264002	New fees apply to certain delivery options online or by phone.	13	ok
7810867	Energy expenditure consists of resting, thermogenic, and physical activity components.	15	ok
959389	LPN programs offer varying degrees and career focus options.	12	ok
1763826	Calculating net Social Security income after state taxes applied.	12	ok
3854829	Halo-halo is a Filipino dessert of shaved ice and milk.	15	ok
4762146	Pitts, GA, is known for its sunflower fields.	15	ok
4265297	The Cook Islands celebrate the Tiare Maori flower festival annually.	14	ok
256884	The Sportage features a comprehensive 6-airbag system for safety.	15	ok
8065275	Ralphie May, comedian, passes away at 43 unexpectedly suddenly.	16	ok
6002979	IRS expands home office deduction to include garage workshops.	11	ok
8085208	Cefixime and fluoroquinolones meet efficacy criteria for gonococcal infections.	21	ok
2125220	High-deductible health plans offer lower costs with tax benefits.	14	ok
8817879	Elevated lymphocytes indicate infection or immune system issues.	13	ok
6796233	Coach is a luxury fashion company offering various accessories globally.	12	ok
6468970	Prepare thoroughly before the race with detailed planning and maps.	12	ok
4094130	Blood and urine tests detect pregnancy hormone hCG in pregnancy.	13	ok
8259702	Congress approved $1.6 trillion for war and reconstruction efforts.	14	ok
3040953	Trump seeks a way out of DACA dilemma created by himself.	13	ok
7136129	Blanket mortgage allows partial property sales without full payoff.	12	ok
6552129	Neurosurgery is a highly compensated medical specialty globally.	12	ok
5386784	Verdigris' AI scans equipment for hidden problems and issues.	15	ok
6449023	John Schnabel, 96, passes away peacefully at home.	14	ok
3806998	Shoulder flexion involves axillary nerves and specific muscles.	13	ok
144040	Amazon updates Fire TV Stick with faster processor and Wi-Fi.	13	ok
4218975	Renovating a bathroom can be a cost-effective long-term investment.	15	ok
2544597	Dunedin High School's outdated technology and favoritism hindered my tutoring experience.	19	ok
2557944	Varsity experience and film are key for D1 recruitment.	13	ok
7545944	Corel Draw 7 serial key generator and activation tools.	13	ok
6968545	Advent Hope Campus Ministry fosters spiritual growth and community.	13	ok
435672	Contact Chevrolet by phone for questions or feedback.	10	ok
621011	Stimulus is an incentive or physiological trigger.	11	ok
7110290	Bichon Frise dogs are intelligent, charming, and highly scented.	17	ok
5696859	Combine lemon juice, mustard, and herbs in marinade mixture.	14	ok
3588142	Theft involves taking someone's property without permission or consent.	13	ok
2594578	Late arrivals may prefer individual ride tickets on Thursdays.	12	ok
6958910	Movie's success relies on animal performances of popular songs.	12	ok
7120894	Sheriff's offices in Beaumont, Anahuac, and Conroe listed nearby.	19	ok
8557569	Vehicle fuel costs are influenced by several key factors.	11	ok
2309566	Statistical analysis examines discrete data using quantifiable measures and models.	14	ok
7121649	Austria-Hungary arrests Gavrilo Prinzip in Sarajevo incident.	19	ok
3036699	Key figures discovered DNA as genetic material's fundamental role.	12	ok
8600609	Common hermit crab species are widely kept as pets.	12	ok
6622018	Banks set limits on accounts for security and control.	12	ok
4697717	Spin is an intrinsic angular momentum in quantum mechanics.	11	ok
7701098	Companies must understand and manage accepted risks within strategy.	11	ok
4130624	The Gemellus Inferior muscle rotates the thigh laterally.	14	ok
5902463	The rubbery material exhibited remarkable elasticity and self-recovery properties.	14	ok
1896154	Titration relies on pH indicator to show equivalence point.	12	ok
7868446	ASUS boards have a Q-connector for HDD LED connection.	14	ok
8686134	Carolina Golf Cars offers affordable golf carts with various options.	13	ok
5057215	Yellow marrow converts to red marrow in severe blood loss.	12	ok
4332210	Miko Grimes advises husband to ignore NFL coaches' guidance.	14	ok
1705092	Trinidad and Tobago gained freedom from slavery in 1834.	15	ok
7986603	Doctor Christophe Orssaud edits book on congenital nystagmus.	17	ok
1091313	Adapting oral presentations to situational demands effectively.	12	ok
6220801	We've achieved our first sale after two weeks of use.	13	ok
7545188	Adults should exercise 3 times a week for better balance.	14	ok
806306	Largest waterfalls by continent, varying heights worldwide.	12	ok
2494733	Check park website for summer road construction updates beforehand.	11	ok
2002776	Nostalgic memories of carefree times with a lifelong friend.	15	ok
7469657	Exterior angle of a regular polygon is defined precisely.	12	ok
3136361	Cut squash into flat pieces with a sharp knife.	11	ok
3999079	CMOS battery keeps time and date even when off.	12	ok
3094379	Perissodactyls and artiodactyls share a common ancient ancestor.	19	ok
3394392	Slaves were considered the property of another person historically.	12	ok
3482368	Ross Dudle examines the Johnson House filming location in Twin Peaks.	14	ok
1419039	Indium(III) oxide is an amphoteric indium compound.	16	ok
3332205	Dogs' brains respond positively to their owner's scent specifically.	14	ok
653452	Racine Police Department provides law enforcement services and public records.	14	ok
2620296	Summer plantings require close monitoring in southern US regions.	12	ok
3458285	Sensor placement varies near radiator and headlight area.	11	ok
4327129	Columbus, Mississippi, has various notable landmarks and institutions.	14	ok
3589194	Watch movies in HD quality on various devices instantly.	11	ok
3666815	Western Wyoming has various snake species varying by region.	11	ok
5589960	Natalie's friends were unaware of her true age until death.	15	ok
2077412	Banana is a common name for various Musa species.	13	ok
3454947	Knowledge management encompasses creation, dissemination, and utilization of knowledge processes.	14	ok
898407	Everyone likes a friendly person, a careful Bob sings well.	13	ok
8646488	Warning: diclofenac may cause serious cardiovascular risks and side effects.	16	ok
5122159	Direct current is a type of constant voltage.	10	ok
2357006	The trapezius muscle assists in neck and breathing movements.	14	ok
6742604	Polyester takes decades to decompose like plastic bottles.	12	ok
6578527	Bob Dylan's death sparks global concern among fans suddenly.	12	ok
2027597	Jen Carfagno hosts AMHQ weekdays on The Weather Channel.	16	ok
1154009	Electronic oscillator produces periodic oscillating electronic signals from DC power.	13	ok
1745471	Polyurethane takes 30 days to fully cure and harden completely.	16	ok
2379408	The Bahamas has a stable parliamentary democracy with a prime minister.	13	ok
6569737	Types of plaster for home DIY projects are widely available.	12	ok
7624965	Mayonnaise is a French sauce base for various accompaniments.	15	ok
1780491	KFC seeks experienced Restaurant General Manager in Cuyahoga Falls.	15	ok
527991	Visual schedules boost independence and alleviate anxiety in individuals.	11	ok
7944692	Injured players often face limited opportunities after major surgery.	12	ok
86827	Grant of summary judgment is reviewed de novo by appellate court.	13	ok
4621307	Argentina disputes Falkland Islands' ownership with the UK historically.	13	ok
7495175	Check your cat's temperature to determine if it has a fever.	14	ok
5323634	MRI showing a brain lesion. A brain lesion is an abnormality	14	ok
8703872	John McAfee, computer security pioneer, is wanted for murder.	14	ok
3001861	Recovery time varies greatly after bowel surgery depending on factors.	13	ok
4694134	Request Certificate of Good Standing from Delaware Secretary of State.	12	ok
8222512	Hannity airs live Monday through Thursday, replacing Hannity & Colmes.	16	ok
6481474	Enzyme assays use positive and negative controls for accuracy.	13	ok
1339449	Determiners clarify specific nouns in language instruction.	10	ok
6953852	Low-residue diet avoids high-fiber foods to minimize cramping symptoms.	16	ok
7888578	EWG evaluates product ingredients based on scientific literature and ratings.	13	ok
4249337	Find your Toyota Sienna front door switch locally online.	12	ok
6629155	Mercy Personal Physicians serves Baltimore County communities with primary care.	13	ok
6290088	Cockroaches rely heavily on water for survival and thrive indoors.	15	ok
6022980	Fertility peaks around 14 days after the start of menstruation.	15	ok
8135058	Bob Smallwood has completed his final earthly journey peacefully.	12	ok
2336509	UV-cured powder coating process explained in a short animated video.	14	ok
8125844	Trump's Mar-a-Lago trips cost taxpayers millions of dollars annually.	15	ok
7663149	Port and polish enhances performance with simple yet effective principles.	12	ok
8662850	Digestive issues may cause stomach pain after eating frequently.	12	ok
1115672	Biomagnetism therapy uses magnets to balance body pH levels.	14	ok
3049729	Essential life skills for daily functioning and personal growth.	12	ok
2430601	Elvis Presley's alleged comeback is being secretly kept hidden.	14	ok
3200301	Public records available for search in Worcester City database.	11	ok
2957541	Remnants of something remaining after its primary use.	11	ok
3647241	Experienced fishing guide with extensive freshwater expertise and diverse species.	13	ok
8514549	Molecules are classified as organic or inorganic based chemistry.	13	ok
6413552	Dodge Dart is a compact car produced from 1960-2016.	17	ok
982793	Eastern Standard Time vs Eastern Daylight Time differ by one hour.	14	ok
7850197	Air Supply's debut album released in December 1976 peaked locally.	15	ok
577403	Medications like Cogentin and Amantadine alleviate akathisia symptoms daily.	19	ok
7141706	The S.S. Minnow is a historic vessel in British Columbia.	15	ok
145682	Employer contributes to pension alongside employee's own contributions.	12	ok
3516187	Invest in versatile jeans for everyday and special occasions.	11	ok
3176004	Visit Powhatan Farmers Market today for fresh produce and treats.	14	ok
3626809	Fossa is Madagascar's largest carnivorous mammal with unique appearance.	15	ok
4553645	Card Verification Value Codes are security features on credit cards.	12	ok
4478962	Tradescantia pallida is a species of spiderwort commonly known wandering jew.	18	ok
7541158	Some actors possess incredibly distinctive and memorable speaking voices.	11	ok
6122875	Egypt, Assyria, and Israel will coexist in harmony together.	15	ok
1097871	Epsom salt foot soaks improve sleep and relaxation.	13	ok
6706912	Christian liturgies recall Christ's sacrifice in remembrance of him.	15	ok
6446574	Altrusa International fosters global community development through volunteer efforts.	14	ok
307603	Self-regulation is key to effective learning through strategic engagement.	13	ok
5357611	Tingling lips may indicate hormonal or circulatory issues.	13	ok
7461062	BSA Health System offers clinical excellence in Texas Panhandle region.	14	ok
2537432	Illinois residents receive a 5% property tax credit.	13	ok
4235846	Using local lenders offers faster and more personalized service.	11	ok
707527	Software tool removes Trojan Horses and Internet Worms effectively.	13	ok
7028636	The show crafts emotional climaxes in nearly every scene.	12	ok
5001830	Hotel near Toyota Stadium in Frisco, Texas, highly rated.	14	ok
882781	Dominance in genetics masks recessive allele effects in phenotypes.	14	ok
2590313	Many people waited to celebrate the writer's birth, 1975, on December 30.	20	ok
2045678	Active RN license in another state or territory is exempt.	12	ok
7746090	Fungi, plants, and animals are multicellular organisms.	13	ok
6303174	Verizon charges $35 activation fee for new service setup.	13	ok
7034770	Sour mash is a whiskey distillation process, not flavor.	14	ok
2827227	Camping site near Cotopaxi, CO with scenic creek views.	16	ok
8161531	Merrill advisors expand Bank of America presence nationwide gradually.	13	ok
6076812	Bile is a greenish fluid aiding fat digestion and absorption.	14	ok
2347418	Oregon University has multiple off-campus research facilities and institutes.	12	ok
7118356	Hazlet Township is represented by Frank Pallone in New Jersey.	14	ok
