2171802	Escrow account transactions are detailed on the settlement statement.	12	ok
5882917	Byron name popularity has varied over the years significantly.	12	ok
7890024	Eating well-balanced meals is crucial during pregnancy.	12	ok
3796669	Cimetidine increases sertraline hydrochloride's A	14	ok
1554782	Traveller woods - 30 Jan 2015, 	14	ok
3617451	Burma's history dates back to the Neolithic era.	13	ok
7332540	Syringe sizes and insulin units per line are specified.	13	ok
6071347	Turning thermostat back 7-10 degrees can save 10 percent.	15	ok
2249143	Self-employed workers face higher tax burden for education and car expenses.	14	ok
6587482	Thursday is the day for a red twist tie.	11	ok
8229195	Firms employ turnaround and divestment strategies to revitalize operations.	15	ok
1690021	Millennials are a demographic cohort following Generation X generation.	13	ok
6932700	Angelfish can live for 5-10 years with proper care.	16	ok
3904053	US average salary decreased to $51,017 in 2012 slightly.	16	ok
3839927	Salamanders are amphibians with unique regenerative abilities worldwide.	14	ok
6389038	HIV viral load and CD4 count monitor disease progression.	13	ok
3855463	Fibromyalgia causes unusual swelling in hands and feet.	14	ok
7961788	Bangalore to Visakhapatnam flights operate daily with 2 flights.	16	ok
7700714	Syfy renews fantasy drama series The Magicians for season 2.	16	ok
1398188	Marrero Carmen M DO - Total MD in West Palm Beach.	15	ok
6864952	Ampere defined by elementary charge flow rate.	11	ok
6961334	Midline incision provides access to internal organs during surgery.	13	ok
5346561	Soursop is a tropical fruit native to the Americas.	13	ok
5591057	Future capital costs exceed growth rate, leading to bankruptcy.	12	ok
6617666	Aga owners need to consider fuel options and costs.	12	ok
4969092	Students' interests in tech education vary by activity and topic.	13	ok
8015116	Nutella is a tasty spread made from hazelnuts and cocoa.	15	ok
568902	TriMet's Portland-Milwaukie Light Rail project is on schedule and under budget.	20	ok
3148926	Respond promptly to maintain a good impression and show respect.	12	ok
2066715	France and Spain to raise retirement ages to 62-67.	14	ok
1127767	To become a licensed pest control applicator in Texas requires education.	14	ok
855715	Walmart revives layaway program for holiday shopping season.	13	ok
2874010	Expert shares tips on identifying hidden sodium in foods.	11	ok
5396759	Anti-abortion activists protest outside the U.S. Capitol against Planned Parenthood.	15	ok
2053727	Fire ants are reddish-brown, tiny, and nest in various locations.	17	ok
7073824	New spaces designed for various healthcare professional programs and classes.	12	ok
2147567	CashMe rewards users with cashback and points at merchants.	13	ok
2581189	Organizational structure emerges through internal critical thinking discussions.	11	ok
6396051	Use a fine wire brush to clean spark plug components.	12	ok
7601101	The Department of Defense's official website is defense.gov online.	13	ok
2057540	Abscesses are caused by staphylococcal bacterial infections.	16	ok
2224488	Charlize Theron fights HIV awareness in her homeland.	13	ok
8176320	Rinse quinoa before cooking with water and salt.	13	ok
6474304	Maryland lottery games are drawn multiple times weekly.	11	ok
5209409	Sort job descriptions by title, class, or grade easily.	13	ok
7721660	Joe Greene, Hall of Fame tackle, born on September 24th, 1946.	20	ok
5367602	Federalism with centralized authority over state and local governance.	12	ok
7980388	A solemn promise to a dying sister has had lasting impact.	13	ok
881857	Robert Ri'chard is an African-American actor with Louisiana roots.	15	ok
8021993	Energy is lost in each food chain due to respiration.	13	ok
1493741	Manual underwriting process can be lengthy and unpredictable.	11	ok
6322259	States decide on adult Medicaid dental services availability.	10	ok
3449505	Vitex agnus-castus eases menstrual issues and menopause symptoms.	19	ok
4816405	Apollo 11 astronauts broadcast historic moon landing footage worldwide instantly.	13	ok
7788898	William Grant congratulates his uncle on his escape and bravery.	13	ok
1990640	Stingrays congregate near shallow waters off the beach entrance.	14	ok
8706514	Skype became a popular video communication platform rapidly worldwide.	12	ok
8135706	Medical Avatar creates personalized 3D health models on mobile devices.	14	ok
8841208	American of English-speaking descent, specifically non-Hispanic origin.	14	ok
1683469	Impressionism shifted from objective to subjective self-portrait representation.	14	ok
2792249	Season chicken breasts with salt, pepper, and sage, then pound.	15	ok
348158	Emu Oil is a versatile carrier oil for skin health.	13	ok
4108245	Dandy-Walker syndrome affects cerebellum and surrounding fluid-filled brain spaces.	17	ok
7249771	Duppa chose the name Phoenix due to Masonic influences.	13	ok
2072959	Dental care provider inspects teeth and jaw for underlying health issues.	15	ok
6228551	Baclofen withdrawal causes pruritus in some patients frequently.	15	ok
8025100	Tiger balm offers numerous health benefits and uses worldwide.	13	ok
305490	CMS introduces new HCPCS modifiers for modifier -59 scrutiny.	13	ok
8047611	Aluminum wires pose fire risks due to maintenance needs.	12	ok
5059805	The Zohar is a foundational Jewish mystical text.	12	ok
2067323	European powers colonized Southeast Asia from the 1500s to mid-1940s.	20	ok
4374213	Muscle cells store large amounts of creatine phosphate.	12	ok
2274413	Constitutional rights not explicitly listed are still protected.	12	ok
5808401	Asthma triggers cause inflammation and symptoms in sensitive airways.	14	ok
880328	Enumclaw Insurance Group expanded its business in the 1950s.	16	ok
4896905	Iconic RV brand returns with new models at California show.	13	ok
4549684	Théodore Géricault's Raft of the Medusa breaks Neoclassical norms.	21	ok
7674477	Using whois.net reveals domain ownership information online easily.	12	ok
6002222	Dialysis nurses' salaries vary significantly by job title and experience.	15	ok
4816246	Brown bears inhabit Arctic and Polar Regions worldwide naturally.	11	ok
1735034	Riser duct suffers from build-ups, alkali, and chemical damage.	16	ok
2723199	Mature red blood cells are eukaryotic without a nucleus.	15	ok
4189800	Mayor Ed Fare donates $15,000 to Camp Anchor program.	15	ok
6873377	Drinking green tea is beneficial with proper hydration balance.	12	ok
7017580	Pink eye can be caused by various factors including viruses and bacteria.	14	ok
729017	We've got 64 definitions for BIS Â» What does	14	ok
859217	Business jargon often uses headcount for simple counts.	12	ok
3348752	State parks offer endless outdoor adventures for family gatherings.	11	ok
7602819	Functional ovarian cysts occur in pre-menopausal women during ovulation.	16	ok
199627	Muscle fibers exhibit diverse characteristics and functions naturally.	11	ok
2469483	Linen is primarily made from flax plant fibers mostly.	13	ok
2543	Watermelon is rich in various beneficial carotenoids naturally occurring.	14	ok
4343038	One foundational Bible verse that gives us a time frame for when Satan	14	ok
3836691	Informix-CLI is a connectivity tool for Informix database servers.	15	ok
1753954	Donald Trump's personal life involves marriage and four children.	12	ok
2371586	Coaches in boys' sports generally earn higher average salaries nationwide.	14	ok
6034367	Arlington's population grew 348% in Tennessee from 2000 to 2010.	21	ok
5650722	Mark centre of rotation and shape corners on tracing paper.	12	ok
7876213	Branch hours vary by day of the week.	10	ok
1830160	Passport services available on weekdays, except summer Saturdays.	12	ok
7675453	Saint Kitts and Nevis gained independence in 1983 gradually.	15	ok
8322925	Avocado oil is a natural fat extracted from avocados.	14	ok
2262187	Condoms with spermicides kill sperm before they reach uterus.	14	ok
7419401	Chemises differ from camisoles in length and design.	13	ok
3885949	LDL levels indicate cardiac risk, with ideal below 100 mg/dL.	17	ok
1118140	Companies with good reputations charge more upfront for quality service.	13	ok
6754813	Medications can cause a range of unusual side effects sometimes.	13	ok
6211371	Asurion's phone system provides interactive options for customer support.	14	ok
3108488	Hockey subreddit offers resources for beginners and enthusiasts worldwide.	12	ok
1641487	Magistrate reviews complaint to determine probable cause for warrant.	12	ok
4307556	Federal grand jury and petit jury have distinct roles.	11	ok
7700162	Annotated bibliographies organize citations with detailed summaries.	11	ok
2053772	Elevate legs to reduce swelling during pregnancy.	11	ok
4326282	Millions of Americans suffer from osteoporosis and low bone mass.	15	ok
2795786	Vobara protective case for Apple Watch available now.	12	ok
7454266	Combine dry ingredients, then add wet ingredients to muffin cups.	14	ok
3534664	Use SCAMPER to improve existing products or services.	12	ok
2600057	Modern trench coat features iconic checks and gleaming hardware details.	13	ok
8080716	Current is a rate of flow measured in amps.	11	ok
4513823	Gently washing and drying helps umbilical stump fall off.	14	ok
5977109	Knowledge of one's actions or possessions is a legal requirement.	13	ok
4922391	Rheumatoid arthritis treatment falls into three distinct categories naturally.	14	ok
2028973	We'd love to see you in person! Please feel free to	14	ok
3037712	Wharton School's MBA program is one of the world's finest.	15	ok
8017137	Search detainee by name and country of birth if A-Number unavailable.	16	ok
4391803	IQ scores are compared to standardised population norms.	11	ok
2155830	Deep veins run alongside arteries, sharing their names.	11	ok
5712608	Becoming a data analyst requires research and education.	12	ok
5914558	Vegetarians and vegans risk B12 deficiency with age.	14	ok
3757889	Abdominal pain may indicate stomach issues requiring medical attention.	13	ok
8789036	The Punisher series may debut on Netflix in late 2017.	15	ok
8241542	HealthCare Partners offers varying salaries nationwide, ranging from $27,495 to $203,018.	21	ok
7671977	Query optimizer estimates higher cardinality with exponential component.	11	ok
5259364	Here are the 12 military and government definitions for ADOC:	14	ok
40293	Migraine symptoms include nausea, with many other common symptoms.	14	ok
8725640	Best supplements for mass promote muscle growth and recovery.	11	ok
358293	Schedule meetings between Hawaii and New York at optimal times.	12	ok
4075890	Click Preview then Print to finalize the poster layout.	11	ok
6278807	Google Chrome's open-source sibling browser, Sleipnir, offers unique features.	18	ok
582978	Arnold Schwarzenegger was born in Austria to Gustav and Aurelia.	18	ok
4271730	Neptune is a gas giant with layered composition.	11	ok
4688271	Sculptra treatment delayed due to recent Juvederm injection.	15	ok
7354907	Lisla suffers from frequent nettle stings on her feet.	15	ok
3848461	Poetry techniques and imagination are developed through personal experiences.	12	ok
812317	Stimulation testing measures hormone response in the endocrine system.	13	ok
7750194	StudyBlue provides geography course materials at Western Kentucky University.	12	ok
4919201	Requirements for New York State Creative Arts Therapist License	11	ok
2719327	Vice President's salary and benefits are significantly higher nationwide.	13	ok
3848532	Labrador Retriever originated from Newfoundland, not Labrador.	13	ok
4323474	Historical records of medieval currency usage are documented.	11	ok
2631110	Ellington's style evolved from 1920s Harlem influences to solo mastery.	17	ok
7213695	High blood glucose during pregnancy poses serious risks to baby.	12	ok
6906345	Mono symptoms include severe sore throat, swollen glands, and fever.	14	ok
5650551	Estimated cost of mass deportation is between $41 and $46 billion.	15	ok
7423444	Higher mathematics is a challenging and unfamiliar subject area.	11	ok
7913543	Mt Healthy High School has high free lunch assistance rates statewide.	13	ok
8762272	Paolo Zampolli had a privileged upbringing in Italy.	14	ok
7142475	Non-profit organization supports visually impaired Ohioans with equality services.	13	ok
3625345	Martin Luther King assassinated in Memphis, Tennessee in 1968.	15	ok
8022839	_*The word to which the phrase expresses a relation*_	12	ok
395646	Caboose is a service car in freight trains nowadays.	12	ok
2743100	Richard Gere promotes peaceful living through Buddhist philosophy.	11	ok
6540571	Hulless barley has various uses and is a cereal grain.	14	ok
5261813	A mature 16-year-old can make informed decisions about parental separation.	15	ok
6518911	Excess semester hours do not count toward graduation.	11	ok
1234776	Self-taught individual learns through personal study and hands-on experience.	15	ok
5491407	UK conservatory prices vary greatly depending on size and style.	13	ok
4429390	Notable locations in 92104 include libraries, churches, and parks.	16	ok
6324924	Government contract costs must meet FAR Subpart 31.2 criteria.	15	ok
4084588	Sesame Street introduces Julia, a Muppet with autism.	14	ok
6502613	Solar eclipse selfies can cause eye damage, experts warn strongly.	13	ok
7228482	Authorized personnel submit online requests through NU Portal Self Service.	12	ok
5067068	Albert Pujols is close to Hank Aaron's career RBI record.	15	ok
2286830	Cyberbullying rates rise with age among students nationwide significantly.	14	ok
8092951	Sensitive Compartmented Information Facility with designated security authority.	12	ok
3461655	Create a cluster column chart in Excel automatically.	10	ok
5990395	Formal advertising strategies rely on a positioning statement.	11	ok
6051190	Bellevue's population grew significantly between 2000 and 2014.	17	ok
7449568	Pneumonia symptoms vary greatly depending on individual factors.	12	ok
5050183	Donor designations guide organ donation process for families.	12	ok
8197797	First Sergeant is a senior military rank in Singapore.	11	ok
4417641	He focuses on early intervention for children with disabilities.	11	ok
7184970	Palliative care specialists discuss discontinuing statin therapy at end life.	16	ok
421864	We stayed at Yankee Inn for a Tanglewood concert.	13	ok
5939162	calories: 250, fat: 8g, carbs	14	ok
1102826	Ripley is Tennessee's county seat with a population of 7,844.	18	ok
138049	Create a Roblox account before starting your first game.	12	ok
8254340	Ring of Fire is a volcanic zone around Pacific Ocean.	12	ok
7649596	Low-carb foods that aid fat burning and thermic effect.	14	ok
3988723	Construction of Titanic began in Belfast shipyards in 1909 officially.	15	ok
2092877	Clay cooking offers numerous health and flavorful benefits naturally.	12	ok
3836998	Euflexxa injection causes allergic reactions and serious side effects.	14	ok
7377384	Polypropylene is used in various applications including carpets and ropes.	14	ok
7843910	King Fahd International Airport and Bahrain International Airport nearby.	12	ok
2276067	Bacteria have various protective outer capsule structures naturally occurring.	12	ok
4747149	Lake Forest offers various recreational activities and public parks.	11	ok
7007734	Choroidal metastasis often has no noticeable symptoms initially.	13	ok
2524228	Duluth sees significant snowfall in the Halloween Blizzard of 1991.	17	ok
3911239	Toxins are poisonous substances produced by various organisms naturally.	13	ok
1915713	The First Amendment protects church-state separation and freedom.	11	ok
6648046	The troposphere is the lowest atmospheric weather layer.	11	ok
6700414	Organic gardener disagrees with neighbor's use of superphosphate fertilizers.	17	ok
7392457	Cat has UTI, treated with home remedies and vet visit.	14	ok
7548167	Dr. Calvin Ramsey is a male Internal Medicine Doctor in Mississippi.	14	ok
6269988	Homeowner transforms yard with Fabulous Flower Beds in 3 days.	15	ok
5161851	UC transfer admissions vary by location and competitiveness.	10	ok
561537	Manhattan co-ops often ban washing machines due to flooding.	14	ok
3899336	Relying on brakes alone is a very unsafe driving practice.	14	ok
4076115	Burgundy has most AOCs, emphasizing terroir in wine.	17	ok
6705995	Tylenol takes longer to relieve pain than expected.	12	ok
4698088	Weather radar uses parabolic dishes to detect and range weather.	13	ok
8700482	The singer has the same old blues repeatedly.	10	ok
5076231	Nonfat yogurt with various fruit and natural flavorings.	12	ok
2237890	Cool Cat faces bullying from Derrick, his arch-nemesis.	14	ok
5179976	Mark Twain originated from a steamboat term indicating 12-foot depth.	16	ok
6742751	Three-toed sloth inhabits South America and Central America slowly.	15	ok
647233	Long runs cause temporary weight gain, normalizes within 24 hours.	15	ok
4780913	She attends a dinner at Breadstix with Puckerman family.	15	ok
3724766	Carbohydrates are broken down into fatty acids for energy storage.	14	ok
3127	Alaska and Hawaii have unique island characteristics and geography.	12	ok
6381241	Esch-sur-Sure is situated near the River Sûre.	15	ok
3075886	The Metropolitan Museum's Egyptian collection is a must-see attraction.	14	ok
7733537	Find affordable hotel rooms with Juan Hotels online easily.	11	ok
1847976	Common flexor tendon attaches to the humerus near elbow.	13	ok
5424847	Ancient Greeks pondered the composition of perceptible objects.	13	ok
648416	Blueprints and truing are often misused in factory actions.	14	ok
2011332	IP address search provides limited information about the location.	11	ok
4439557	Terraria game features various armor and items for players.	12	ok
1545672	New medication Xanax XR causes fatigue and mental fogginess.	14	ok
8028767	Facial expressions convey meaning through speech and body language.	12	ok
8015073	1950s vintage sewing pattern for a stunning draped bodice dress.	15	ok
3860996	View Homework Help - Production Possibility Frontier Practice Problems Complete from E	14	ok
1548788	Rabies virus causes fatal acute encephalitis in warm-blooded animals.	17	ok
8036013	Surimi is made from ground white fish paste.	11	ok
8403090	Warm and breezy weather with potential rain on Saturday.	12	ok
5380445	Italian songs compiled from popular charts and enduring popularity.	11	ok
5354941	Virginia college tuition is $12,869, 71% cheaper than average.	17	ok
798493	To receive or put something into the body.	10	ok
3851129	TSA to require passports for four states' residents next year.	14	ok
3360276	Missouri v. Jenkins addresses judicial desegregation remedies in education.	15	ok
1746718	Monocots and dicots have distinct seed characteristics.	12	ok
50989	Iowa snow depth reports are available nationwide.	10	ok
7893122	Florida law requires a $225 fee for vehicle registration.	12	ok
6175545	Military life increasingly prioritizes family over traditional career.	11	ok
730328	Tesla's high price poses significant financial risks for investors.	12	ok
7295651	Seeds provide dormant embryos for plant growth and reproduction.	12	ok
2883783	Ukraine impacts Russia's self-image as a great power significantly.	14	ok
1906851	Vitamin D sources include cod liver oil and fatty fish.	13	ok
4981558	Ancient Rome was a complex Italic civilization from 8th century BC.	17	ok
4090872	Betty White's biggest regret is not spending time with loved ones.	15	ok
3610917	Vacuoles are water-filled storage spaces in animal and plant cells.	15	ok
3042190	Use NIST servers for alternative time and date services.	12	ok
3329170	One liter equals approximately 33.814 fluid ounces US.	13	ok
3331285	Zebra offers innovative technologies for business value and security.	12	ok
2623524	Muscle control is crucial for long-term stability and overall health.	14	ok
3491363	SetLength changes string or array size dynamically.	10	ok
3105027	Purchasing an AED is a life-saving business decision.	14	ok
4217797	Registered Nurses earn $64,000 with varying state-based salaries nationwide.	15	ok
4569192	Phoenix Lights were a widely observed UFO sighting in Arizona.	12	ok
1327525	California Restaurant Association presents seminar on workplace inclusivity and diversity.	13	ok
3342758	Designing a waterfall involves natural or excavated slopes and foundations.	14	ok
7728946	Kristallnacht originated from shattered glass in post-pogrom Germany.	16	ok
4696235	Michael Vick breaks Eagles' quarterback rushing yards record previously held.	13	ok
6535053	She won multiple beauty titles, craves comfort and confident partner.	14	ok
7404036	Follow a healthy weight-loss regimen with measured shakes and snacks.	13	ok
8808263	Bernie Sanders' net worth varies significantly over time estimates.	13	ok
6628865	Babies typically stand between 8-10 months old successfully.	14	ok
1553248	Tempo runs involve a warm-up, hard interval, and cool-down routine.	17	ok
1606041	Blossom end rot is caused by calcium deficiency in tomatoes.	14	ok
7042204	Australia is the smallest continent under the vast Pacific Ocean.	12	ok
8494764	Celery seed may have various health benefits and uses.	12	ok
3036881	Document signed by Justus B. Smith in Lebanon.	12	ok
3203939	Bananas ripen after separation from the plant, regardless length.	14	ok
5335610	Patient has severe pain after taking medication combination.	10	ok
6168368	Roast tri-tip in oven to desired doneness temperature.	13	ok
3457132	The ADA provides grants for kids' smile programs nationwide.	12	ok
3864351	Nicaragua is a large Central American country bordering oceans.	14	ok
509476	Familiarize yourself with various rose types for your garden.	13	ok
2901331	Cities near Laurel, MD include South Laurel, Maryland City, and North Laurel.	17	ok
2003587	Pencil skirt is a tailored, straight-cut skirt design.	13	ok
7707881	Vitamin B12 deficiency causes various gastrointestinal and neurological symptoms.	13	ok
674140	Kansas City experiences hot summers and cold winters.	10	ok
5415400	Foot pain requires medical evaluation by a specialist immediately.	11	ok
3140108	Setting is crucial in both fiction and non-fiction writing.	12	ok
2425714	Tacos offer a diverse range of fillings and options.	13	ok
4691613	Soil testing involves analyzing pH and essential nutrient levels.	12	ok
8534387	American businesses invested $125.9 billion in employee learning development.	14	ok
2564280	Optical screens enhance image visibility in projection systems.	11	ok
322042	Practical e-book offers advice on natural remedies for common ailments.	14	ok
24747	Open Internet Explorer, select Tools, then Delete browsing history.	13	ok
6105463	What do light, X-rays, heat radiation, microwaves	14	ok
4566474	Claim N.C. standard deduction on Form D-400, line 11.	17	ok
7596868	Restaurant kitchen hood cleaning and servicing frequency varies greatly.	11	ok
3951270	Becoming a neurosurgeon requires years of education and training.	16	ok
6866279	Aristotle formulated the law of non-contradiction concept.	15	ok
1570634	DHEA doses vary for diabetes treatment and administration methods.	13	ok
6821981	Infrared radiation occupies a range between visible and radio waves.	13	ok
5765786	Duck eggs take varying incubation times depending on species.	13	ok
5127069	Autoimmune disease gaps in healthcare model need urgent attention worldwide.	13	ok
6265437	Sony Pictures Entertainment is a leading Indian entertainment company globally.	12	ok
3104839	Zip code 07410 is in Bergen County, New Jersey.	14	ok
8818522	New rule 41F affects NFA trust operations nationwide significantly.	14	ok
2899595	Cognitive technologies improve rapidly, transforming business and daily life.	13	ok
2414873	Chapisirca, Bolivia 10-day weather forecast from The Weather Channel.	17	ok
433321	Colorism is a form of prejudice based on skin color.	13	ok
3380587	Tian Tan Buddha, a large bronze statue of Buddha.	13	ok
1432901	Neptune is the farthest planet from the sun in our Solar System.	16	ok
7705131	Parkinson's disease causes postural instability and gait issues.	14	ok
6147857	Driving from Brooklyn to Rochester takes approximately 5.08 hours.	14	ok
6612222	Tripolymer foam can save energy and reduce outside noise.	13	ok
1436749	Estrogen therapy improves sleep patterns in postmenopausal women.	14	ok
7441319	Pennsylvania hospitals offer pediatric care and emergency services nearby.	12	ok
8443569	Desert Southwest experiences mild temperature rise in February gradually.	12	ok
7834774	Boeing shifted focus to commercial aircraft after the war.	12	ok
4122606	Digging for quicksilver in Dawnstar town requires a pickaxe.	15	ok
1075971	Converting grams to atoms requires two steps: moles and Avogadro's number.	19	ok
8003788	Inflatable neck collars provide traction therapy at home.	13	ok
3782012	Nurse seeks detailed scope of practice information online.	11	ok
8822665	Retail merchandisers manage product placement and pricing effectively.	12	ok
1701633	Use a 15-pin VGA cable for laptop to TV connection.	14	ok
5987176	A milligram is a smaller unit of mass.  Here's	14	ok
4972097	Chemical reactions involve energy transfer and change.	10	ok
4708897	CBS renews Unforgettable for a third season this summer.	13	ok
3904741	Vanadium has 20 isotopes, one stable isotope V-51.	17	ok
7819575	The term gimoozaabi originates from Native American roots.	13	ok
7701050	Study examines reclamation impact on Batam Island's northern coast.	14	ok
3642439	Annual reports may be stored in Delaware Public Archives.	11	ok
4800107	Sensi Seeds offers a wide selection of medicinal cannabis strains.	13	ok
8812532	Electric light revolutionized daily life and urban infrastructure significantly.	12	ok
4552115	Use stone veneer for a dry-fit, low-maintenance exterior look.	16	ok
3415978	Jupiter and Venus are putting on a spectacular evening show.	13	ok
7237758	Accidental injuries claim many lives in the United States annually.	13	ok
3163136	Luxury airport transportation services in the Seattle metropolitan area.	12	ok
3288871	Apple pollination groups vary by climate and flowering time.	12	ok
5315155	Fluid behind the knees, also known as knee effusion, causes pain and stiffness.	18	ok
